Title, Platform, Date 
TRANCE VR, PC, May 25, 2017 
NEKOPARA Vol. 3, PC, May 25, 2017 
Tanks vs Aliens, PC, May 25, 2017 
Vanquish, PC, May 25, 2017 
Starving, PC, May 25, 2017 
UBERMOSH Vol.5, PC, May 25, 2017 
Block Legend, PC, May 25, 2017 
Haunted Hotel: Personal Nightmare, PC, May 25, 2017 
Quarantine, PC, May 24, 2017 
Caveblazers, PC, May 24, 2017 
Nano Project, PC, May 24, 2017 
Global Soccer Manager 2017, PC, May 24, 2017 
Medusa's Labyrinth VR, PC, May 24, 2017 
Unit 4, PC, May 24, 2017 
Spacecats with Lasers, PC, May 24, 2017 
Ophidia, PC, May 24, 2017 
Through The Dark: Prologue, PC, May 24, 2017 
P-Walker's Simulation, PC, May 24, 2017 
Black Desert Online: Explorer's Package, PC, May 24, 2017 
Black Desert Online: Traveler's Package, PC, May 24, 2017 
Polygon Nightmare, PC, May 24, 2017 
Embers of Mirrim, PC, May 23, 2017 
Mirage: Arcane Warfare, PC, May 23, 2017 
StarCrawlers, PC, May 23, 2017 
Starpoint Gemini Warlords, PC, May 23, 2017 
SmuggleCraft, PC, May 23, 2017 
Dynasty Feud, PC, May 23, 2017 
Steel Division: Normandy 44, PC, May 23, 2017 
Samurai Warriors: Spirit of Sanada, PC, May 23, 2017 
Spellspire, PC, May 23, 2017 
Ricky Raccoon, PC, May 23, 2017 
Fuzecat, PC, May 23, 2017 
Heart's Medicine - Hospital Heat, PC, May 23, 2017 
Plague Road, PC, May 23, 2017 
The Fidelio Incident, PC, May 23, 2017 
Trackmania 2 Lagoon, PC, May 23, 2017 
Killers and Thieves, PC, May 23, 2017 
Darkness and Flame: Missing Memories, PC, May 23, 2017 
Assassin's Creed: Brotherhood - Copernicus Conspiracy, PC, May 23, 2017 
Impact Winter, PC, May 22, 2017 
Mind OVR Matter, PC, May 22, 2017 
Walkerman, PC, May 22, 2017 
The Elder Scrolls Online: Morrowind, PC, May 22, 2017 
Delila's Gift, PC, May 22, 2017 
Aeon, PC, May 22, 2017 
Sudden Strike II: Gold, PC, May 22, 2017 
Defenders of the Realm VR, PC, May 22, 2017 
Ruby Maze Adventure 2, PC, May 22, 2017 
Masked Shooters, PC, May 21, 2017 
Dangerous Bullets, PC, May 21, 2017 
High Templar VR, PC, May 21, 2017 
Formula E powered by Virtually Live, PC, May 20, 2017 
The Forgotten Fairy Tales: The Spectra World, PC, May 20, 2017 
Skylar & Plux: Adventure on Clover Island, PC, May 19, 2017 
Endless Space 2, PC, May 19, 2017 
Wandersong, PC, September 27, 2018 
Broken Reality, PC, September 27, 2018 
Magic: The Gathering Arena, PC, September 27, 2018 
INSOMNIA: The Ark, PC, September 27, 2018 
Rounders (Arena), PC, September 27, 2018 
Deep Space Waifu: FANTASY, PC, September 27, 2018 
Koropokkur in Love: A Little Fairy's Tale, PC, September 27, 2018 
Merrily Perilly, PC, September 27, 2018 
Life is Strange 2, PC, September 27, 2018 
Attack Helicopter Dating Simulator, PC, September 27, 2018 
Draoi, PC, September 27, 2018 
Wall Walker, PC, September 27, 2018 
Ball run and rush, PC, September 27, 2018 
Pit Blocks 3D, PC, September 27, 2018 
Dragon Ball FighterZ: Cooler, PC, September 27, 2018 
Solid Aether, PC, September 27, 2018 
The Twelve Trials, PC, September 27, 2018 
Resynth, PC, September 27, 2018 
Life is Strange 2: Episode 1 - Roads, PC, September 27, 2018 
Brainf***, PC, September 27, 2018 
Taco Truck Madness, PC, September 27, 2018 
Infinity (2018), PC, September 27, 2018 
2nd Circle - Powerful Places, PC, September 27, 2018 
Attractorache, PC, September 27, 2018 
HENTAI BOY, PC, September 27, 2018 
Chocolate makes you happy: Halloween, PC, September 27, 2018 
New Star Manager, PC, September 27, 2018 
Kulzas Tomb, PC, September 27, 2018 
Late at night, PC, September 27, 2018 
DingDingDing, PC, September 27, 2018 
Quixzel Rush: Christmas Helper, PC, September 27, 2018 
Jellyfish Season, PC, September 27, 2018 
ILive, PC, September 27, 2018 
!BurnToDie!, PC, September 27, 2018 
Looking for Food, PC, September 27, 2018 
The Hot Dog would Explode, PC, September 27, 2018 
Super Furi Puzzles, PC, September 27, 2018 
Tiger Striker, PC, September 27, 2018 
Dragon Ball FighterZ: Android 17, PC, September 27, 2018 
Living Legends: Fallen Sky, PC, September 27, 2018 
Toilet Run, PC, September 27, 2018 
XALT: Last Stand, PC, September 27, 2018 
Deep Sky Derelicts, PC, September 26, 2018 
Niffelheim, PC, September 26, 2018 
Pig Eat Ball, PC, September 26, 2018 
The Works of Mercy, PC, September 26, 2018 
Path to Mnemosyne, PC, September 26, 2018 
The Great Fantasy Struggle, PC, September 26, 2018 
Vox Machinae, PC, September 26, 2018 
AS+CEND, PC, September 26, 2018 
Meritocracy of the Oni & Blade, PC, September 26, 2018 
The Nature, PC, September 26, 2018 
Let It Die, PC, September 26, 2018 
The Crew 2: Gator Rush, PC, September 26, 2018 
One Piu Day, PC, September 26, 2018 
Wandering Owl, PC, September 26, 2018 
Land of an Endless Journey, PC, September 26, 2018 
oOo: Ascension, PC, September 26, 2018 
Cat Fu Mi, PC, September 26, 2018 
SHEEP SLING, PC, September 26, 2018 
Snuffles and Co., PC, September 26, 2018 
Snowball Saves Summer, PC, September 26, 2018 
Only Shadows Left Behind, PC, September 26, 2018 
Bad Neighbor, PC, September 26, 2018 
Cthulhu Mythos RPG -The Sleeping Girl of the Miasma Sea-, PC, September 26, 2018 
Furry Animals Bombing, PC, September 26, 2018 
Night Magic, PC, September 26, 2018 
Fish Duel, PC, September 26, 2018 
Potion island, PC, September 26, 2018 
Quixzel Rush: Tooth Protector, PC, September 26, 2018 
Andor - the Cards of Wonder, PC, September 26, 2018 
Drift Stunt Racing 2019, PC, September 26, 2018 
Kaiki Gensou Yume Monogatari Kaijuu Sakura Hebi Den, PC, September 26, 2018 
Dark Deception, PC, September 26, 2018 
Field of Glory II: Rise of Persia, PC, September 26, 2018 
Fire Pro Wrestling World: New Japan Pro-Wrestling Collaboration, PC, September 26, 2018 
Mandy's Room, PC, September 26, 2018 
Taimanin Asagi -Battle Arena-, PC, September 26, 2018 
Timespinner, PC, September 25, 2018 
Dakar 18, PC, September 25, 2018 
V-Rally 4, PC, September 25, 2018 
Pillars of Eternity II: Deadfire - Seeker, Slayer, Survivor, PC, September 25, 2018 
Creed: Rise to Glory, PC, September 25, 2018 
Valkyria Chronicles 4, PC, September 25, 2018 
Little Bug, PC, September 25, 2018 
Pathfinder: Kingmaker, PC, September 25, 2018 
MMA Simulator, PC, September 25, 2018 
The Conjuring House, PC, September 25, 2018 
The Walking Dead: The Telltale Series - The Final Season Episode 2: Suffer the Children, PC, September 25, 2018 
Mummy on the run, PC, September 25, 2018 
BreakHack, PC, September 25, 2018 
Valkyria Chronicles 4: A Captainless Squad, PC, September 25, 2018 
Valkyria Chronicles 4: Edy's Advance Ops, PC, September 25, 2018 
Valkyria Chronicles 4: A United Front with Squad 7, PC, September 25, 2018 
Wuxia archive: Crisis escape, PC, September 25, 2018 
Skater Cally, PC, September 25, 2018 
Crystal War, PC, September 25, 2018 
A Top-Down Job: Blood Gain, PC, September 25, 2018 
Gold Magic 800, PC, September 25, 2018 
Dash Island, PC, September 25, 2018 
Hollow, PC, November 16, 2017 
Visual Novel Maker, PC, November 16, 2017 
Cutthroat, PC, November 16, 2017 
Retro Space Shooter (2017), PC, November 16, 2017 
Mistake Souls, PC, November 16, 2017 
How To Meat People, PC, November 16, 2017 
Sparc, PC, November 16, 2017 
Bygone Worlds: Ephesus, PC, November 16, 2017 
Mount Hill, PC, November 16, 2017 
Codename: Phantom, PC, November 16, 2017 
Imperi, PC, November 16, 2017 
Wrath of Loki VR Adventure, PC, November 16, 2017 
Cleo's Lost Idols, PC, November 16, 2017 
Yu-Gi-Oh! Duel Links, PC, November 16, 2017 
Queen's Garden Sakura Season, PC, November 16, 2017 
Unforgiving Happiness, PC, November 15, 2017 
Bike of the Wild, PC, November 15, 2017 
Succubus Rem, PC, November 15, 2017 
The Sapper, PC, November 15, 2017 
BHB: BioHazard Bot, PC, November 15, 2017 
CS2D, PC, November 15, 2017 
Space Lagat, PC, November 15, 2017 
Perspectives: Aleppo-Helsinki, PC, November 15, 2017 
Guide The Ball, PC, November 15, 2017 
3D Tower, PC, November 15, 2017 
Sudokube, PC, November 15, 2017 
Pillars of Eternity: Definitive Edition, PC, November 15, 2017 
Skript, PC, November 15, 2017 
SpaceCoaster VR, PC, November 15, 2017 
Ride with son, PC, November 15, 2017 
Play with Gilbert, PC, November 15, 2017 
University Life, PC, November 15, 2017 
There Is A Genie In My Szechuan Sauce, PC, November 15, 2017 
Rasty Pelican, PC, November 15, 2017 
Happy Santa, PC, November 15, 2017 
NO ONE, PC, November 15, 2017 
Train Runner VR, PC, November 15, 2017 
Choice, PC, November 15, 2017 
Duel Jousting, PC, November 15, 2017 
Scrolls of the Lord, PC, November 15, 2017 
External Visions, PC, November 15, 2017 
Redemption Cemetery: One Foot in the Grave, PC, November 15, 2017 
Elven Legend 5: The Fateful Tournament, PC, November 15, 2017 
Rory's Restaurant Origins, PC, November 15, 2017 
Killing Floor: Incursion, PC, November 14, 2017 
From Other Suns, PC, November 14, 2017 
Beekyr Reloaded, PC, November 14, 2017 
Tokyo Tattoo Girls, PC, November 14, 2017 
Outcast: Second Contact, PC, November 14, 2017 
LEGO Marvel Super Heroes 2, PC, November 14, 2017 
Harvest Moon: Light of Hope, PC, November 14, 2017 
Farming Simulator 17: Platinum Edition, PC, November 14, 2017 
Farming Simulator 17: Platinum Expansion, PC, November 14, 2017 
GUTS, PC, November 14, 2017 
Steam Tactics, PC, November 14, 2017 
Far from Noise, PC, November 14, 2017 
Ben 10, PC, November 14, 2017 
Hyakki Castle, PC, November 14, 2017 
Thy Sword, PC, November 14, 2017 
ATV Drift & Tricks, PC, November 14, 2017 
Trove: Adventures, PC, November 14, 2017 
Duelyst: Immortal Vanguard, PC, November 14, 2017 
HexaMon, PC, November 14, 2017 
High Noon VR, PC, November 14, 2017 
RibbonChase, PC, November 14, 2017 
Oure, PC, November 14, 2017 
Chinese Paladin: Sword and Fairy 6, PC, November 14, 2017 
Fidget Spinner In Space, PC, November 14, 2017 
Pixel Space Battles, PC, November 14, 2017 
Gunship Battle2 VR, PC, November 14, 2017 
Jump Gunners, PC, November 14, 2017 
Clad in Iron: Philippines 1898, PC, November 14, 2017 
Draft Day Sports: College Basketball 2017, PC, November 14, 2017 
TEEN DATE SIMULATOR, PC, November 14, 2017 
JigsawMania, PC, November 14, 2017 
This War of Mine Stories: Father's Promise, PC, November 14, 2017 
Qajary Cat, PC, November 14, 2017 
Fantasy Mosaics 25: Wedding Ceremony, PC, November 14, 2017 
Xianjian Qixia Zhuan 6, PC, November 14, 2017 
RacetronicVR, PC, November 13, 2017 
STATUS: INSANE, PC, November 13, 2017 
AZURA, PC, November 13, 2017 
Skein, PC, November 13, 2017 
Layers, PC, November 13, 2017 
Gachimuchi, PC, November 13, 2017 
A Wonder, PC, November 13, 2017 
Galactic Lords, PC, November 13, 2017 
Time Killers: Spot Race, PC, November 13, 2017 
Deep GachiGASM, PC, November 13, 2017 
The Arena of Gladiators, PC, November 13, 2017 
Tronix Defender, PC, November 13, 2017 
Super BoxMan Ultra, PC, November 13, 2017 
Eseapner, PC, November 13, 2017 
REPULSE: Galactic Rivals, PC, November 13, 2017 
Jaguar I-PACE Concept, PC, November 13, 2017 
Escape!VR -Above the Clouds-, PC, November 13, 2017 
Deep Sorrow, PC, November 12, 2017 
Moose Invasion, PC, November 12, 2017 
Nekojishi, PC, November 12, 2017 
Next, PC, November 11, 2017 
The Bonfire: Forsaken Lands, PC, March 9, 2018 
The Fruitless Flower, PC, March 9, 2018 
The Frosty Leaves, PC, March 9, 2018 
5 Star Hawaii Resort - Your Resort, PC, March 9, 2018 
Prismatix, PC, March 9, 2018 
Triplicity, PC, March 9, 2018 
Super Sonic Racer, PC, March 9, 2018 
Puzzle Lab, PC, March 9, 2018 
Garden of Oblivion, PC, March 9, 2018 
Tropical Liquor, PC, March 9, 2018 
Destiny of Light, PC, March 9, 2018 
NickProject, PC, March 9, 2018 
TopShot: Darkness, PC, March 9, 2018 
Content Creator Simulator, PC, March 9, 2018 
Live the Guitar, PC, March 9, 2018 
Mission Of Hero, PC, March 9, 2018 
Calvin Tucker's Farm Animal Racing, PC, March 9, 2018 
Volotic, PC, March 9, 2018 
Alien Crusader, PC, March 9, 2018 
Suicideville, PC, March 9, 2018 
Dead Rain - New Zombie Virus, PC, March 9, 2018 
Milky Way Map, PC, March 9, 2018 
Colour Box, PC, March 9, 2018 
Epic Snowday Adventure, PC, March 9, 2018 
Landlord VR, PC, March 9, 2018 
Cubiques 2, PC, March 9, 2018 
Lunapark VR, PC, March 9, 2018 
Re;Lord 1 ~The witch of Hertfort and stuffed animals~, PC, March 9, 2018 
Greece Defense TD, PC, March 9, 2018 
The Wizards, PC, March 8, 2018 
Demolish & Build 2018, PC, March 8, 2018 
Guns'n'Stories: Bulletproof VR, PC, March 8, 2018 
Chessaria: The Tactical Adventure, PC, March 8, 2018 
Warhammer: Vermintide 2, PC, March 8, 2018 
Galactic Pocket Billiards, PC, March 8, 2018 
Hearts of Iron IV: Waking the Tiger, PC, March 8, 2018 
Hatsune Miku VR, PC, March 8, 2018 
My Lovely Daughter, PC, March 8, 2018 
Temple of Spikes, PC, March 8, 2018 
Wayhaven Chronicles: Book One, PC, March 8, 2018 
H0ST, PC, March 8, 2018 
Magikiras, PC, March 8, 2018 
Brick Breaker Bunch, PC, March 8, 2018 
Keep in Mind: Remastered, PC, March 8, 2018 
NaziShootout, PC, March 8, 2018 
Battle Ion, PC, March 8, 2018 
Satan's Castle, PC, March 8, 2018 
SUPER BENBO QUEST: TURBO DELUXE, PC, March 8, 2018 
The Agency: Chapter 2, PC, March 8, 2018 
7th Deep, PC, March 8, 2018 
ABYSS CRAWLERS plus, PC, March 8, 2018 
Ball laB, PC, March 8, 2018 
DJ Mole, PC, March 8, 2018 
Chinese Tomb Story, PC, March 8, 2018 
Big Blue: Memory, PC, March 8, 2018 
Wild Glory, PC, March 8, 2018 
Magic Tower 3D, PC, March 8, 2018 
!4RC4N01D! 3: Cold Space, PC, March 8, 2018 
Wedding VR: Masamune, PC, March 8, 2018 
Wedding VR: Henry, PC, March 8, 2018 
Wedding VR: Yamato, PC, March 8, 2018 
Railroad operator, PC, March 8, 2018 
SUPER ASTEROIDS, PC, March 8, 2018 
Graveyard Birds, PC, March 8, 2018 
BREATHE, PC, March 8, 2018 
Cthulhu, PC, March 8, 2018 
MEGALONIA, PC, March 8, 2018 
Fuse Balls, PC, March 8, 2018 
Lurk, PC, March 8, 2018 
Tardy, PC, March 8, 2018 
Total War: Rome II - Desert Kingdoms Culture Pack, PC, March 8, 2018 
Drakeling Labs, PC, March 8, 2018 
Haunted Hotel: Lost Dreams, PC, March 8, 2018 
Earthlock, PC, March 8, 2018 
Brain Puzzle, PC, March 8, 2018 
Thievery (2018), PC, March 8, 2018 
Back to the 80's, PC, March 8, 2018 
Acceleration of SUGURI 2, PC, March 7, 2018 
Northgard, PC, March 7, 2018 
Kite, PC, March 7, 2018 
CHUCHEL, PC, March 7, 2018 
Domiverse, PC, March 7, 2018 
DEAD DOZEN, PC, March 7, 2018 
Dark Old Sun, PC, March 7, 2018 
Nova Wing, PC, March 7, 2018 
Adventures of Hendri, PC, March 7, 2018 
Gift of Life: Key of Solomon, PC, March 7, 2018 
BSL Winter Game Challenge, PC, March 7, 2018 
Senran Kagura: Peach Beach Splash, PC, March 7, 2018 
Twin Blue Moons, PC, March 7, 2018 
My Sweet Waifu, PC, March 7, 2018 
Virtual Ninja VR, PC, March 7, 2018 
ASCII Game Series: Pinball, PC, March 7, 2018 
Bloody and cruel story of toys, PC, March 7, 2018 
The Final Days: Blood Dawn, PC, March 7, 2018 
Geometry Runner Online, PC, March 7, 2018 
Dive, PC, March 7, 2018 
Archibald, PC, March 7, 2018 
Silenced: The House, PC, March 7, 2018 
The Directed, PC, March 7, 2018 
Total War: WARHAMMER - Isabella von Carstein, PC, February 28, 2017 
Spellarium, PC, February 28, 2017 
River City Ransom: Underground, PC, February 27, 2017 
Armored Gear, PC, February 27, 2017 
Stories Untold, PC, February 27, 2017 
HeapVR, PC, February 27, 2017 
Energia, PC, February 27, 2017 
Smackitball, PC, February 27, 2017 
Flix and Chill, PC, February 27, 2017 
Langoth, PC, February 27, 2017 
RC-AirSim: RC Model Airplane Flight Simulator, PC, February 27, 2017 
Super Cuber, PC, February 27, 2017 
Furious Angels, PC, February 27, 2017 
Big City War, PC, February 27, 2017 
Otome Romance Jigsaws: Midnight Cinderella & Destined to Love, PC, February 27, 2017 
Eraser & Builder, PC, February 27, 2017 
The Bedtime Story, PC, February 27, 2017 
Rogue'n Roll, PC, February 27, 2017 
Tethered, PC, February 27, 2017 
Village Story, PC, February 27, 2017 
Pimp Tight, PC, February 27, 2017 
Ping Pong League, PC, February 27, 2017 
Glyphs Apprentice, PC, February 27, 2017 
Oodlescape: The Apocalypse, PC, February 26, 2017 
Weapon Shop Fantasy, PC, February 26, 2017 
Dark Romance: Romeo and Juliet, PC, February 25, 2017 
Resident Evil 7: biohazard - Banned Footage Vol. 1, PC, February 24, 2017 
Hollow Knight, PC, February 24, 2017 
911 Operator, PC, February 24, 2017 
The Golf Club VR, PC, February 24, 2017 
City Climber, PC, February 24, 2017 
The Inner Darkness, PC, February 24, 2017 
Wizrogue: Labyrinth of Wizardry, PC, February 24, 2017 
The Shadows of Pygmalion, PC, February 24, 2017 
Midnight at the Celestial Palace: Chapter I, PC, February 24, 2017 
Land it Rocket, PC, February 24, 2017 
Seabed Prelude, PC, February 24, 2017 
KByte, PC, February 24, 2017 
Geology Business, PC, February 24, 2017 
Just VR Slingshot Target Practice, PC, February 24, 2017 
Seasteader, PC, February 24, 2017 
Hyper Knights, PC, February 24, 2017 
Red String of Fate, PC, February 24, 2017 
Sleengster 2, PC, February 24, 2017 
UniBall, PC, February 24, 2017 
Legend of the Skyfish, PC, February 24, 2017 
Lost in the Ocean VR, PC, February 24, 2017 
ACTION MAHJONG, PC, February 24, 2017 
REVENGE: First Blood, PC, February 24, 2017 
Planetoid, PC, February 24, 2017 
Dogolrax, PC, February 24, 2017 
Absent Mind, PC, February 24, 2017 
BRAIN / OUT, PC, February 24, 2017 
TROID BLASTER, PC, February 24, 2017 
Zombie in my city, PC, February 24, 2017 
Magazine Editor, PC, February 24, 2017 
Pirate Mosaic Puzzle. Caribbean Treasures, PC, February 24, 2017 
Forma.8, PC, February 23, 2017 
Eternal Return, PC, February 23, 2017 
Shadows of Adam, PC, February 23, 2017 
Vive le Roi, PC, February 23, 2017 
Frog Hop, PC, February 23, 2017 
Unforgiven VR, PC, February 23, 2017 
Dark Parables: Requiem for the Forgotten Shadow, PC, February 23, 2017 
Four Last Things, PC, February 23, 2017 
DYE, PC, February 23, 2017 
Choppa, PC, February 23, 2017 
Paulo's Wing, PC, February 23, 2017 
You, With Me - A Kinetic Novel, PC, February 23, 2017 
Sakura Magical Girls, PC, February 23, 2017 
Drop Hunt: Adventure Puzzle, PC, February 23, 2017 
Runt of the Litter, PC, February 23, 2017 
Skills Hockey VR, PC, February 23, 2017 
Stupid Raft Battle Simulator, PC, February 23, 2017 
Nevrosa: Prelude, PC, February 23, 2017 
Deus Ex: Mankind Divided - A Criminal Past, PC, February 23, 2017 
Mosaic: Game of Gods II, PC, February 23, 2017 
Sid Meier's Civilization VI: Australia, PC, February 23, 2017 
Shift Happens, PC, February 22, 2017 
Beauty Bounce, PC, February 22, 2017 
Missileman Origins, PC, February 22, 2017 
Unexplored, PC, February 22, 2017 
Herald: An Interactive Period Drama, PC, February 22, 2017 
Bedfellows FRENZY, PC, February 22, 2017 
Dodge Master, PC, February 22, 2017 
Super Spring Ninja, PC, February 22, 2017 
The source of evil, PC, February 22, 2017 
Open Sorcery, PC, February 22, 2017 
A Trip to Yugoslavia: Director's Cut, PC, February 22, 2017 
Polterheist, PC, February 22, 2017 
FreeStyle Football, PC, February 22, 2017 
Stolen Steel VR, PC, February 22, 2017 
COLOPL VR GARAGE, PC, February 22, 2017 
Dependable Daisy: The Wedding Makeover, PC, February 22, 2017 
IGT Slots: Day of the Dead, PC, February 22, 2017 
Halo Wars: Definitive Edition, PC, February 21, 2017 
Night in the Woods, PC, February 21, 2017 
Pixel Privateers, PC, February 21, 2017 
Ethereal Legends, PC, February 21, 2017 
Syrian Warfare, PC, February 21, 2017 
Survivor, PC, April 22, 2019 
Azurael's Circle: Chapter 4, PC, April 22, 2019 
Skyward, PC, April 22, 2019 
The Underground Watcher, PC, April 22, 2019 
The Counterattack OF Sacrifice, PC, April 22, 2019 
Space Whip, PC, April 22, 2019 
Dead Quest, PC, April 22, 2019 
Earthshakers, PC, April 22, 2019 
Macabre Ring 2: Mysterious Puppeteer, PC, April 22, 2019 
Hentai Babes - Broken Vows, PC, April 21, 2019 
Sexy Miss, PC, April 20, 2019 
The Cat and the Box, PC, April 20, 2019 
Cat Defense, PC, April 20, 2019 
Fast Travel: Loot Delivery Service, PC, April 20, 2019 
Crystallo, PC, April 20, 2019 
Chaos Knight-interlude, PC, April 20, 2019 
Multiple Views Objects, PC, April 20, 2019 
Adecke - Cards Games Deluxe, PC, April 20, 2019 
B. Braun Aesculap Spine VR, PC, April 19, 2019 
Talk to Strangers, PC, April 19, 2019 
Beyond The Veil, PC, April 19, 2019 
Ritual of the Moon, PC, April 19, 2019 
Donald VS Martians, PC, April 19, 2019 
Siluman Fantasy, PC, April 19, 2019 
GhostGame, PC, April 19, 2019 
Race for Tuning, PC, April 19, 2019 
Yinyang, PC, April 19, 2019 
You Died but a Necromancer revived you, PC, April 19, 2019 
Animal Fight Club, PC, April 19, 2019 
Drumpfy Walls, PC, April 19, 2019 
The Last Contact, PC, April 19, 2019 
Witch Ring Meister, PC, April 19, 2019 
Gamble Fight Plus, PC, April 19, 2019 
Paper Dolls Original, PC, April 19, 2019 
Exogenesis ~Perils of Rebirth~, PC, April 19, 2019 
Burning Daylight, PC, April 19, 2019 
Haunted Jail: Alcatas, PC, April 19, 2019 
Marvin The Hatter, PC, April 19, 2019 
CPU Architecture Sim, PC, April 19, 2019 
Tether Together, PC, April 19, 2019 
Hello, World., PC, April 19, 2019 
The Kaiju Offensive, PC, April 19, 2019 
Victory is justice!, PC, April 19, 2019 
Discharge, PC, April 19, 2019 
3x3 mini-Shogi, PC, April 19, 2019 
Nyasha Valkyrie, PC, April 19, 2019 
Rain's Love, PC, April 19, 2019 
3D Custom Lady Maker, PC, April 19, 2019 
Hour of the Snake, PC, April 19, 2019 
Magic Clouds, PC, April 19, 2019 
6120, PC, April 19, 2019 
Castle Of Pixel Skulls, PC, April 19, 2019 
Shukujo Douhou -New Division-, PC, April 19, 2019 
Emergency Water Landing, PC, April 19, 2019 
Hentai Oppai, PC, April 19, 2019 
Blacksmith Run, PC, April 19, 2019 
Breeding Village, PC, April 19, 2019 
Space Trade Fleet 1.5, PC, April 19, 2019 
Shadow of the Tomb Raider: The Path Home, PC, April 19, 2019 
VCB: Why City 4k, PC, April 19, 2019 
Katana ZERO, PC, April 18, 2019 
Driftland: The Magic Revival, PC, April 18, 2019 
The Padre, PC, April 18, 2019 
Forager, PC, April 18, 2019 
God's Trigger, PC, April 18, 2019 
Don't Look Down, PC, April 18, 2019 
Abberbury, PC, April 18, 2019 
Mystery Trackers: The Fall of Iron Rock, PC, April 18, 2019 
Save Koch, PC, April 18, 2019 
The Lord of the Rings: Journeys in Middle-earth, PC, April 18, 2019 
Man In Women's Clothes, PC, April 18, 2019 
Arcade Classics Anniversary Collection, PC, April 18, 2019 
Trinoline, PC, April 18, 2019 
Darkest Depths, PC, April 18, 2019 
Prologue for a Vacant Kingdom, PC, April 18, 2019 
YGGDRASIL JIGSAW PUZZLE, PC, April 18, 2019 
Toran, PC, April 18, 2019 
Slow.Bullet VR, PC, April 18, 2019 
Overcooked! 2: Campfire Cook Off, PC, April 18, 2019 
Bunker - Nightmare Begins, PC, April 18, 2019 
Nurse Love Syndrome, PC, April 18, 2019 
Amber's Airline - 7 Wonders, PC, April 18, 2019 
The Elemental Heart, PC, April 18, 2019 
JQ: cosmos, PC, April 18, 2019 
Swords and Sandals Classic Collection, PC, April 18, 2019 
Time Travel VR, PC, April 18, 2019 
Moon Pool, PC, April 18, 2019 
Dances with Butterflies VR, PC, April 18, 2019 
Feed  A Titanosaur, PC, April 18, 2019 
Hello, Goodbye, PC, April 18, 2019 
Wheel Travel, PC, April 18, 2019 
Ballista Legend, PC, April 18, 2019 
Seven Bullets Zombie Apocalypse, PC, April 18, 2019 
Game club "Waka-Waka", PC, April 18, 2019 
D.H.Trouble Guy, PC, April 18, 2019 
Elon Must - Road to Respect, PC, April 18, 2019 
Peas Adventure, PC, April 18, 2019 
Scream of the Viking REDUX, PC, April 18, 2019 
Succubus Contract, PC, April 18, 2019 
Total War: WARHAMMER II - The Prophet & The Warlock, PC, April 17, 2019 
Nekojishi, PC, November 12, 2017 
Next, PC, November 11, 2017 
Left-Hand Path, PC, November 10, 2017 
Need for Speed Payback, PC, November 10, 2017 
Zombie Waiting, PC, November 10, 2017 
Football Manager 2018, PC, November 10, 2017 
The Sims 4: Cats & Dogs, PC, November 10, 2017 
Space Asteroid Shooter: Retro Achievement Hunter, PC, November 10, 2017 
Sorry, James, PC, November 10, 2017 
Spring Breeze, PC, November 10, 2017 
StrainZ-1: Elimination, PC, November 10, 2017 
Lost in the tomb, PC, November 10, 2017 
Bottle: Pilgrim, PC, November 10, 2017 
Magical Squash, PC, November 10, 2017 
Fantasy of Eden, PC, November 10, 2017 
Bars and Balance, PC, November 10, 2017 
Harvest Life, PC, November 10, 2017 
Zomborg, PC, November 10, 2017 
Onimod Land, PC, November 10, 2017 
Turf Wars, PC, November 10, 2017 
Scorb VR, PC, November 10, 2017 
Solar Collector, PC, November 10, 2017 
Sword Bros, PC, November 10, 2017 
Zorbit's Orbits, PC, November 10, 2017 
FallenCore, PC, November 10, 2017 
BALL GAME, PC, November 10, 2017 
Save the Halloween, PC, November 10, 2017 
Sector 177, PC, November 10, 2017 
Neven, PC, November 10, 2017 
Adventures Of Pipi, PC, November 10, 2017 
Perspectrip, PC, November 10, 2017 
Pinball (baKno Games), PC, November 10, 2017 
Salvation in Corruption, PC, November 10, 2017 
Psi Project 2, PC, November 10, 2017 
Psi Project, PC, November 10, 2017 
VR Hybrid War 2117, PC, November 10, 2017 
I'm Lost, PC, November 10, 2017 
Eiyu*Senki: The World Conquest, PC, November 10, 2017 
Spark (2017), PC, November 10, 2017 
Choose Wisely, PC, November 10, 2017 
KARAKARA2, PC, November 10, 2017 
All That Remains, PC, November 10, 2017 
Split Of Knight, PC, November 10, 2017 
Myths of the World: Behind the Veil, PC, November 10, 2017 
Sphinx and the Cursed Mummy, PC, November 10, 2017 
Chamber of Darkness, PC, November 10, 2017 
Mahjong Forbidden Temple, PC, November 10, 2017 
Ayo: A Rain Tale, PC, November 9, 2017 
Little Nightmares: The Hideaway, PC, November 9, 2017 
Children of Apollo, PC, November 9, 2017 
Football Manager Touch 2018, PC, November 9, 2017 
TransRoad: USA, PC, November 9, 2017 
Wings of Peace VR: DayBreak, PC, November 9, 2017 
The Legendary Player: Make Your Reputation, PC, November 9, 2017 
Oik 3, PC, November 9, 2017 
Fragments (2017), PC, November 9, 2017 
MegaRace 1, PC, November 9, 2017 
Dreamstones, PC, November 9, 2017 
Crimson Earth 2, PC, November 9, 2017 
The Hospital: Allison's Diary, PC, November 9, 2017 
Battle Trendaria, PC, November 9, 2017 
Sky Hunter, PC, November 9, 2017 
Illville: Return instructions, PC, November 9, 2017 
