Title, Platform, Date 
Spacetours VR: Ep1 The Solar System, PC, March 8, 2017 
Tower!3D Pro, PC, March 8, 2017 
Darkarta: A Broken Heart's Quest, PC, March 8, 2017 
Zarya and the Cursed Skull, PC, March 8, 2017 
All Alone: VR, PC, March 8, 2017 
Dream Stone, PC, March 8, 2017 
Pinball Inside: A VR Arcade Game, PC, March 8, 2017 
Hungry Flame, PC, March 8, 2017 
Jigsaw Puzzle: Women's Day, PC, March 8, 2017 
Yeti Adventure, PC, March 8, 2017 
Homefront: The Revolution - Beyond the Walls, PC, March 8, 2017 
Tunnel Runner, PC, March 8, 2017 
Dead by Daylight: Left Behind, PC, March 8, 2017 
World of Warcraft: Battle for Azeroth, PC, August 13, 2018 
Pillage, PC, August 13, 2018 
Professor Watts Memory Match: Yummy Cupcakes, PC, August 13, 2018 
Hentai University, PC, August 13, 2018 
Silentium 2D, PC, August 13, 2018 
Steven Universe: Save the Light, PC, August 13, 2018 
Darken VR, PC, August 13, 2018 
Inn: the Countryside, PC, August 13, 2018 
Caves of Plague, PC, August 13, 2018 
DrillMania, PC, August 13, 2018 
Degeneration, PC, August 13, 2018 
Marbledrome: Crazy Stunt Balls, PC, August 13, 2018 
RoomESC- Secret of the Hidden Room: the Collaborator, PC, August 13, 2018 
Cat doesn't like banana, PC, August 13, 2018 
Simple Racing, PC, August 13, 2018 
Les 4 Alice: Lorange Journey, PC, August 13, 2018 
Mahjongg The Ultimate Collection 2, PC, August 13, 2018 
TREE, PC, August 13, 2018 
The Elder Scrolls Online: Wolfhunter, PC, August 13, 2018 
Fantasy Mosaics 30: Camping Trip, PC, August 13, 2018 
Tale of Palmi, PC, August 12, 2018 
Flameruby, PC, August 12, 2018 
Space Break, PC, August 12, 2018 
Hungry Shadows, PC, August 12, 2018 
Ritter, PC, August 12, 2018 
Magical girl's labyrinth, PC, August 11, 2018 
Basketball Hoop, PC, August 11, 2018 
Professor Watts Memory Match: Fresh Fruit, PC, August 11, 2018 
LUXO Buddies, PC, August 11, 2018 
Puzzle Noid, PC, August 11, 2018 
Ahlman Arcade 2018, PC, August 11, 2018 
PSI Magic, PC, August 11, 2018 
Arkanoid For Painters, PC, August 11, 2018 
War.io : Zombie Battle Royale, PC, August 11, 2018 
Intelligence: Cats, PC, August 11, 2018 
Detective Solitaire Inspector Magic, PC, August 11, 2018 
Path of Sin: Greed, PC, August 11, 2018 
We Happy Few, PC, August 10, 2018 
Colorzzle, PC, August 10, 2018 
Tiny Hands Adventure, PC, August 10, 2018 
Captain The Runner, PC, August 10, 2018 
OneShift, PC, August 10, 2018 
Build buildings, PC, August 10, 2018 
INFINITY RACER, PC, August 10, 2018 
Catch'em, PC, August 10, 2018 
Total 15, PC, August 10, 2018 
Dragonfly Chronicles, PC, August 10, 2018 
PROTEST, PC, August 10, 2018 
Lingering Fragrance, PC, August 10, 2018 
Sakura and Crit: The Mock Game, PC, August 10, 2018 
AstroViking, PC, August 10, 2018 
Board Battlefield, PC, August 10, 2018 
TETRA's Escape, PC, August 10, 2018 
Bunny Minesweeper, PC, August 10, 2018 
NetHack: Legacy, PC, August 10, 2018 
Hectic, PC, August 10, 2018 
Fitzzle Fearless Sharks, PC, August 10, 2018 
Bladequest: The First Chapter, PC, August 10, 2018 
Trumpy Wall, PC, August 10, 2018 
LIBRARY, PC, August 10, 2018 
Hentai Hunter (2018), PC, August 10, 2018 
Gallery One, PC, August 10, 2018 
Step sisters: Episode 1, PC, August 10, 2018 
your diary+, PC, August 10, 2018 
SMASH BOY Ver.KZ, PC, August 10, 2018 
Combiner the Card Game, PC, August 10, 2018 
Choice of Magics, PC, August 10, 2018 
Curiosity, PC, August 10, 2018 
Deiland, PC, August 9, 2018 
City of the Shroud, PC, August 9, 2018 
Monster Hunter: World, PC, August 9, 2018 
Post Scriptum, PC, August 9, 2018 
Deliver Me, PC, August 9, 2018 
Coin-Op Kingdom, PC, August 9, 2018 
Museum of Symmetry, PC, August 9, 2018 
RedEyes, PC, August 9, 2018 
Gensokyo Rolling Force, PC, August 9, 2018 
PUT ANNA, PC, August 9, 2018 
Switcher, PC, August 9, 2018 
Play With Kizami, PC, August 9, 2018 
Total War: Rome II - Rise of the Republic, PC, August 9, 2018 
Perspectrum, PC, August 9, 2018 
Pixel Xiuzhen, PC, August 9, 2018 
Ni no Kuni II: Revenant Kingdom - Adventure Pack, PC, August 9, 2018 
Draw Light, PC, August 9, 2018 
Fort (2018), PC, August 9, 2018 
W. T. B., PC, August 9, 2018 
Puzzle Monarch: Vampires, PC, August 9, 2018 
Repentant, PC, August 9, 2018 
Space Ranger vs. Reptiloids: 2 Edition, PC, August 9, 2018 
Prehistoria, PC, August 9, 2018 
GoFetch, PC, August 9, 2018 
Swap! Swap! Swap!, PC, August 9, 2018 
Three life, PC, August 9, 2018 
Starpoint Gemini Warlords: Endpoint, PC, August 9, 2018 
Detectives United: Origins, PC, August 9, 2018 
Unavowed, PC, August 8, 2018 
Shadowcrawl, PC, August 8, 2018 
CARSTEROIDS, PC, August 8, 2018 
AnimVR, PC, August 8, 2018 
CubeParkour, PC, November 20, 2019 
Iron Sun, PC, November 20, 2019 
Heebie Jeebies: The Roller Coaster, PC, November 20, 2019 
Unlock The King, PC, November 20, 2019 
BlazBlue: Cross Tag Battle - Ver 2.0 Expansion Pack, PC, November 20, 2019 
Alive Hunter, PC, November 20, 2019 
Shenmue III, PC, November 19, 2019 
Narcos: Rise of the Cartels, PC, November 19, 2019 
Haprokon, PC, November 19, 2019 
Drift86, PC, November 19, 2019 
Nancy Drew: Midnight in Salem, PC, November 19, 2019 
Football Manager 2020 Touch, PC, November 19, 2019 
Munchkin: Quacked Quest, PC, November 19, 2019 
Alphaman, PC, November 19, 2019 
Let's See What You Got, PC, November 19, 2019 
Below Sunshade, PC, November 19, 2019 
Age of Wonders: Planetfall - Revelations, PC, November 19, 2019 
Battle Sorcerers, PC, November 19, 2019 
Super Angling, PC, November 19, 2019 
Open World Game: the Open World Game, PC, November 19, 2019 
Forbidden Love With The Ghost Girl, PC, November 19, 2019 
MOLEK-SYNTEZ, PC, November 19, 2019 
Oil Mogul, PC, November 19, 2019 
Shooting Vegetables, PC, November 19, 2019 
KuniTure, PC, November 19, 2019 
Inunaki Tunnel, PC, November 19, 2019 
EBONY, PC, November 19, 2019 
We Happy Few: We All Fall Down, PC, November 19, 2019 
TriangleStorm, PC, November 19, 2019 
BatMUD, PC, November 19, 2019 
Robin Hood: Country Heroes, PC, November 19, 2019 
Kingdom Under Fire II, PC, November 18, 2019 
The Ragdoll, PC, November 18, 2019 
Railroad Corporation, PC, November 18, 2019 
Wild Ride, PC, November 18, 2019 
Football Manager 2020, PC, November 18, 2019 
Diamonds, PC, November 18, 2019 
Miscreation: Evolve Your Creature!, PC, November 18, 2019 
A Familiar Fairytale: Dyslexic Text Based Adventure, PC, November 18, 2019 
Hentai Lover's Train, PC, November 18, 2019 
Shengshi, PC, November 18, 2019 
Npc Problems: Vertex Coloring, PC, November 18, 2019 
Pixel Puzzles Traditional Jigsaws, PC, November 18, 2019 
Play with NEKO, PC, November 18, 2019 
Warhammer: Chaos & Conquest, PC, November 18, 2019 
Space Shapes, PC, November 18, 2019 
Kyle is Famous, PC, November 18, 2019 
Paul's World, PC, November 18, 2019 
Climb Challenge, PC, November 18, 2019 
Eidolon (Integral Games), PC, November 18, 2019 
Kitsune no Tabiji, PC, November 18, 2019 
Drawkanoid: Review Breaker, PC, November 18, 2019 
IL DIVINO: Michelangelo's Sistine Ceiling in VR, PC, November 18, 2019 
Gold of the Incas Solitaire, PC, November 18, 2019 
The Withering, PC, November 17, 2019 
Air Marty, PC, November 17, 2019 
VVVVV, PC, November 17, 2019 
The Last Pixel, PC, November 17, 2019 
Aria Dating Simulator, PC, November 17, 2019 
Counterrealstic Syndrome y, PC, November 17, 2019 
Skyland 1976, PC, November 17, 2019 
Trailing Girl, PC, November 17, 2019 
Star Police, PC, November 17, 2019 
Spring Falls, PC, November 17, 2019 
Harvest Moon: Mad Dash, PC, November 17, 2019 
Redemption Cemetery: The Stolen Time, PC, November 16, 2019 
Cyborg Killer Mockba 2042, PC, November 16, 2019 
Color Soul: Memories, PC, November 16, 2019 
RED EVIL, PC, November 16, 2019 
Escape from the Lostmoon, PC, November 16, 2019 
A Dark World: The Glowing City, PC, November 16, 2019 
Mailbox, PC, November 16, 2019 
Favo!+, PC, November 16, 2019 
Rest In Pieces, PC, November 16, 2019 
Woven, PC, November 15, 2019 
Tokyo Ghoul: re Call to Exist, PC, November 15, 2019 
Fantasy Blacksmith, PC, November 15, 2019 
Gear City Against Chaos, PC, November 15, 2019 
Star Wars Jedi: Fallen Order, PC, November 15, 2019 
Capsule, PC, November 15, 2019 
Buzz Kill Zero, PC, November 15, 2019 
Globesweeper: Hex Puzzler, PC, November 15, 2019 
SHNIPERS, PC, November 15, 2019 
Armortale, PC, November 15, 2019 
Power (2019), PC, November 15, 2019 
Ancient Evil (2019), PC, November 15, 2019 
Between Two Castles - Digital Edition, PC, November 15, 2019 
Super Rebellion, PC, November 15, 2019 
Lewd & Nude | Anime Collector, PC, November 15, 2019 
Nijowari: Where Angels Fall, PC, November 15, 2019 
PUZZLETIME: Castle Party, PC, November 15, 2019 
Space zone defender, PC, November 15, 2019 
Project Cappuccino, PC, November 15, 2019 
Battleships and Carriers - Pacific War, PC, November 15, 2019 
Mass Plus, PC, November 15, 2019 
Mr. Hopp's Playhouse, PC, November 15, 2019 
Tale Of Starship, PC, November 15, 2019 
Fantasy Secret, PC, November 15, 2019 
Dupli_City, PC, November 15, 2019 
Adventure Galaxy, PC, November 15, 2019 
Zig, PC, April 12, 2018 
Naturallandscape: Grand Canyon, PC, April 12, 2018 
Armor Contest, PC, April 12, 2018 
Cyber Fight, PC, April 12, 2018 
Dungeons of the dead, PC, April 12, 2018 
AI Escort, PC, April 12, 2018 
Silverworld, PC, April 12, 2018 
Cross Country Skiing VR, PC, April 12, 2018 
Grim Facade: Broken Sacrament, PC, April 12, 2018 
LifeGameSimulator, PC, April 12, 2018 
The King of Fighters XIV: Steam Edition Upgrade Pack #2, PC, April 12, 2018 
Galactic Civilizations III: Intrigue, PC, April 11, 2018 
Death Toll, PC, April 11, 2018 
Deadly Cryptids, PC, April 11, 2018 
Returner 77, PC, April 11, 2018 
Baseball Kings VR, PC, April 11, 2018 
Archery Kings VR, PC, April 11, 2018 
Arma 3 Tanks, PC, April 11, 2018 
Nuclear 2050, PC, April 11, 2018 
Abduction Prologue: The Story Of Jonathan Blake, PC, April 11, 2018 
BEKKOUAME, PC, April 11, 2018 
Nova Wing II, PC, April 11, 2018 
Another Brick in Space, PC, April 11, 2018 
KeyBoard Guitar Master, PC, April 11, 2018 
The Amazing Bernard, PC, April 11, 2018 
Blacksmith, PC, April 11, 2018 
REVOLT 1917, PC, April 11, 2018 
Sci-fi Chess, PC, April 11, 2018 
Hungry Fish Evolution, PC, April 11, 2018 
Kolb Antarctica Experience, PC, April 11, 2018 
VRQ Test, PC, April 11, 2018 
The Tribloos 3, PC, April 11, 2018 
Kingdom Come: Deliverance - Treasures of the Past, PC, April 11, 2018 
Divinity Defence, PC, April 11, 2018 
Xobox - circle and cross, PC, April 11, 2018 
Deployment, PC, April 10, 2018 
Super Daryl Deluxe, PC, April 10, 2018 
Time Carnage, PC, April 10, 2018 
Dark Rose Valkyrie, PC, April 10, 2018 
Masters of Anima, PC, April 10, 2018 
Zen Chess: Mate in One, PC, April 10, 2018 
Suncore Chronicles: The Tower, PC, April 10, 2018 
The Protocons, PC, April 10, 2018 
The Dreamlands: Aisling's Quest, PC, April 10, 2018 
Exterminate the world, PC, April 10, 2018 
Star-Pit Starship, PC, April 10, 2018 
A Penny For Some Motivation, PC, April 10, 2018 
Bounty Hunter: Ocean Diver, PC, April 10, 2018 
Downbreak, PC, April 10, 2018 
Clicker Planet, PC, April 10, 2018 
RollingBall: Unlimited World, PC, April 10, 2018 
Blonde Driver, PC, April 10, 2018 
ASCII Game Series: Maze, PC, April 10, 2018 
Confederate Express, PC, April 10, 2018 
En Tactico, PC, April 10, 2018 
LEGO Marvel Super Heroes 2: Marvel's Runaways Character and Level Pack, PC, April 10, 2018 
Number World Adventure, PC, April 10, 2018 
New Yankee in King Arthur's Court 5, PC, April 10, 2018 
Extinction, PC, April 9, 2018 
Epic Car Factory, PC, April 9, 2018 
The spy who shot me, PC, April 9, 2018 
ReThink: Evolved 2, PC, April 9, 2018 
Charlotte, PC, April 9, 2018 
Time-Crosser:Joan of arc, PC, April 9, 2018 
Darts and Friends, PC, April 9, 2018 
RUSSIAN PEACE DUCK : TAKE MY NALOGI, PC, April 9, 2018 
JQ: chemistry, PC, April 9, 2018 
Tetripank, PC, April 9, 2018 
Super Weekend Mode, PC, April 9, 2018 
Achievement Hunter: Cat, PC, April 9, 2018 
Mussoumano: Ataque dos Haters, PC, April 9, 2018 
Captive (2018), PC, April 8, 2018 
VR Kanojo, PC, April 8, 2018 
Halu Nibur Unity Edition, PC, April 7, 2018 
Dragonward, PC, April 7, 2018 
Mervin and the Wicked Station, PC, April 7, 2018 
Vector Born, PC, April 7, 2018 
The Andersen Accounts: Chapter One, PC, April 7, 2018 
Galactic Orbital Death Sport, PC, April 6, 2018 
Cefore, PC, April 6, 2018 
Dead (2018), PC, April 6, 2018 
Hard Era: The Fantasy Defence, PC, April 6, 2018 
Farm Manager 2018, PC, April 6, 2018 
Tubular Rift, PC, April 6, 2018 
La Camila: A VR Experience, PC, April 6, 2018 
quadrantica, PC, April 6, 2018 
Fleets of Ascendancy, PC, April 6, 2018 
The Last Hope: Atomic Bomb - Crypto War, PC, April 6, 2018 
R.A.F.A., PC, April 6, 2018 
Global Soccer Manager 2018, PC, April 6, 2018 
Analistica Academy, PC, April 6, 2018 
Whack the Serial Killer, PC, April 6, 2018 
The Adventures of Clive McMulligan on Planet Zeta Four, PC, April 6, 2018 
CRAZY MAZE, PC, April 6, 2018 
ZYTERNION, PC, April 6, 2018 
EverHero, PC, April 6, 2018 
Space Flowers, PC, April 6, 2018 
Elude, PC, April 6, 2018 
Nautical Life, PC, April 6, 2018 
Find someone else, PC, April 6, 2018 
Alteric, PC, July 13, 2016 
MIGHT, PC, July 13, 2016 
Pixeloids, PC, July 13, 2016 
VR Battle Grid, PC, July 13, 2016 
SpellKnights, PC, July 13, 2016 
Iron Commando, PC, July 13, 2016 
The Sunset, PC, July 13, 2016 
Mad Combat Marines, PC, July 13, 2016 
Hidden Clues: New York, PC, July 13, 2016 
MilitAnt, PC, July 12, 2016 
Poly Bridge, PC, July 12, 2016 
The Real Texas, PC, July 12, 2016 
VIDEOBALL, PC, July 12, 2016 
Tumblestone, PC, July 12, 2016 
Anarcute, PC, July 12, 2016 
Under Night In-Birth Exe:Late, PC, July 12, 2016 
Song of the Deep, PC, July 12, 2016 
Necropolis, PC, July 12, 2016 
Ghostbusters, PC, July 12, 2016 
Hiiro, PC, July 12, 2016 
Gun Range VR, PC, July 12, 2016 
Beat Ninja, PC, July 12, 2016 
Push The Crate, PC, July 12, 2016 
Toys of War, PC, July 12, 2016 
InterSection, PC, July 12, 2016 
Depths of Dread, PC, July 12, 2016 
Break Through: Artificial Maze, PC, July 12, 2016 
Night Light, PC, July 12, 2016 
Tank Battle: North Africa, PC, July 12, 2016 
Witan, PC, July 12, 2016 
Pirates of the Polygon Sea, PC, July 12, 2016 
The Path of Greatest Resistance, PC, July 12, 2016 
Mystika 3: Awakening of the dragons, PC, July 12, 2016 
Krai Mira, PC, July 11, 2016 
Abrix for kids, PC, July 11, 2016 
Lion Quest, PC, July 11, 2016 
Rocket Ski Racing, PC, July 11, 2016 
Replica, PC, July 11, 2016 
Line / Dash, PC, July 11, 2016 
MiDZone, PC, July 11, 2016 
Tomato Jones, PC, July 11, 2016 
Bot Vice, PC, July 11, 2016 
Tetradecagon, PC, July 11, 2016 
Firefight, PC, July 11, 2016 
House of Alice, PC, July 11, 2016 
Arma 3 Apex, PC, July 11, 2016 
Killbot: Dead Zone, PC, July 10, 2016 
Leviathan: The Cargo, PC, July 10, 2016 
VR Boxing Workout, PC, July 10, 2016 
The Dark Legions, PC, July 9, 2016 
Moon Colonization Project, PC, July 9, 2016 
Pristine world, PC, July 9, 2016 
DrumKit VR: Play drum kit in the world of VR, PC, July 9, 2016 
Cursed Cases: Murder at the Maybard Estate, PC, July 9, 2016 
Sapper's Bad Dream, PC, July 8, 2016 
Boid, PC, July 8, 2016 
Watch This!, PC, July 8, 2016 
Dead End Road, PC, July 8, 2016 
Fossil Echo, PC, July 8, 2016 
Fly, Glowfly!, PC, July 8, 2016 
Umineko When They Cry: Question Arc, PC, July 8, 2016 
Button Frenzy, PC, July 8, 2016 
Valcarta: Rise of the Demon, PC, July 8, 2016 
Asteroids Minesweeper, PC, July 8, 2016 
Hypnorain, PC, July 8, 2016 
Haven Moon, PC, July 8, 2016 
Mistfal, PC, July 8, 2016 
Memento (CreateLab), PC, July 8, 2016 
Vistascapes VR, PC, July 8, 2016 
Radical Spectrum: Volume 1, PC, July 8, 2016 
Mr. Pumpkin Adventure, PC, July 8, 2016 
Red Trigger, PC, July 8, 2016 
Fly O'Clock, PC, July 8, 2016 
The Last Error, PC, July 8, 2016 
Massive Cleavage vs Zombies: Awesome Edition, PC, July 8, 2016 
VRporize - VR FPS, PC, July 8, 2016 
Mind Spheres, PC, July 8, 2016 
Pigmentone, PC, July 8, 2016 
Rise (New State), PC, July 8, 2016 
Democracy 3: Electioneering, PC, July 8, 2016 
Trizeal Remix, PC, July 7, 2016 
Nurse Love Addiction, PC, July 7, 2016 
Day D: Tower Rush, PC, July 7, 2016 
INSIDE, PC, July 7, 2016 
Deep Space Dash, PC, July 7, 2016 
ChessVR, PC, July 7, 2016 
Kaboom Monsters, PC, July 7, 2016 
Jonah's Path, PC, July 7, 2016 
Ridge, PC, July 7, 2016 
Waddle Home, PC, July 7, 2016 
The Lion's Song, PC, July 7, 2016 
The Lion's Song: Episode 1 - Silence, PC, July 7, 2016 
Evolution Planet: Gold Edition, PC, July 7, 2016 
Momento Temporis: Light from the Deep, PC, July 7, 2016 
Zezenia Online, PC, July 7, 2016 
VRbloX, PC, July 7, 2016 
Shape Shifter, PC, July 7, 2016 
Conan the mighty pig, PC, July 7, 2016 
DUO (NiVision), PC, July 7, 2016 
ViveSpray, PC, July 7, 2016 
DRONES & RUINS, PC, May 22, 2018 
Fhtagn! - Tales of the Creeping Madness, PC, May 22, 2018 
Tennis World Tour, PC, May 22, 2018 
Lords of Strife, PC, May 22, 2018 
Safe House, PC, May 22, 2018 
Stay Safe, PC, May 22, 2018 
Stellaris: Distant Stars, PC, May 22, 2018 
Disco Dodgeball Remix, PC, May 22, 2018 
CCCP CALLS!, PC, May 22, 2018 
Captain Forever Trilogy, PC, May 22, 2018 
Scalak, PC, May 22, 2018 
Save The Villy, PC, May 22, 2018 
Super B-Dino's adventures, PC, May 22, 2018 
Rheum, PC, May 22, 2018 
Babycar Driver, PC, May 22, 2018 
Math Speed Challenge, PC, May 22, 2018 
Math Problem Challenge, PC, May 22, 2018 
Ranger vs. Space Mutants, PC, May 22, 2018 
CrossSide: The Prison, PC, May 22, 2018 
Quarantine Circular, PC, May 22, 2018 
The Witch's Apprentice: A Magical Mishap, PC, May 22, 2018 
Next Day: Survival, PC, May 21, 2018 
Slipstream, PC, May 21, 2018 
gRally, PC, May 21, 2018 
The Elder Scrolls Online: Summerset, PC, May 21, 2018 
X-ray hospital, PC, May 21, 2018 
Paws 'n Claws VR, PC, May 21, 2018 
Omega Commando, PC, May 21, 2018 
Strangers of the Power 2, PC, May 21, 2018 
RetroMaze, PC, May 21, 2018 
Oneirogen, PC, May 21, 2018 
Bob The Cube, PC, May 21, 2018 
Prime Mover, PC, May 21, 2018 
Splash (2018), PC, May 21, 2018 
Hentai Puzzle (2018), PC, May 21, 2018 
President Pig, PC, May 21, 2018 
Jack the Barbarian, PC, May 21, 2018 
TD Ultimate Restocked, PC, May 21, 2018 
Red Spider3: A Heroine Never Dies, PC, May 21, 2018 
Unlight:SchizoChronicle, PC, May 21, 2018 
Nature Calls, PC, May 21, 2018 
Common Hanzi Quiz, PC, May 21, 2018 
Achievement Hunter: Golem, PC, May 21, 2018 
Doors Push or Pull, PC, May 21, 2018 
Heartbreak High: A Break-Up Simulator, PC, May 21, 2018 
Brodefence, PC, May 21, 2018 
Owen to have fun!, PC, May 21, 2018 
Flapp ZVR, PC, May 21, 2018 
Thin Line, PC, May 21, 2018 
The Mercury Man, PC, May 20, 2018 
Indian Mutiny: Little Sepoy, PC, May 20, 2018 
The Far Away Lands, PC, May 20, 2018 
Untouchable, PC, May 20, 2018 
Seek Etyliv, PC, May 19, 2018 
Zombie Hotel, PC, May 19, 2018 
VTree Beach Volleyball, PC, May 19, 2018 
SwordBounce, PC, May 19, 2018 
Kurenai Kumo Gaiden, PC, May 19, 2018 
RECOIL (2018), PC, May 19, 2018 
Block Competition, PC, May 19, 2018 
Destined, PC, May 19, 2018 
Hex Empire 3, PC, May 19, 2018 
Saga of the Nine Worlds: The Hunt, PC, May 19, 2018 
Koloro, PC, May 18, 2018 
Disturbed: Beyond Aramor, PC, May 18, 2018 
Wrecking Towers, PC, May 18, 2018 
Cursed Lands, PC, May 18, 2018 
Creepy Road, PC, May 18, 2018 
Entropy 2120, PC, May 18, 2018 
Sable's Grimoire, PC, May 18, 2018 
Changeover: Decisions, PC, May 18, 2018 
Super GTR Racing, PC, May 18, 2018 
ZombieThon, PC, May 18, 2018 
ATTACK OF THE KILLER FURRIES, PC, May 18, 2018 
Chicken ~Boiled Egg~, PC, May 18, 2018 
Mirror Drop, PC, May 18, 2018 
The Outlaw, The Drunk, & The Whore, PC, May 18, 2018 
LOGistICAL: Caribbean, PC, May 18, 2018 
Roller, PC, May 18, 2018 
Two Inns at Miller's Hollow, PC, May 18, 2018 
Cartoonway: Mini Cars, PC, May 18, 2018 
Degrees, PC, May 18, 2018 
Conjury of Nature, PC, May 18, 2018 
Bunker Rush, PC, May 18, 2018 
Supralympic Runners, PC, May 18, 2018 
Balloon Strike, PC, May 18, 2018 
Pinball 2018, PC, May 18, 2018 
Snake, snake, snake!, PC, May 18, 2018 
Glow Ball - Not A Billiard Puzzle Game, PC, May 18, 2018 
Monster Mother, PC, May 18, 2018 
Mad Dagger 2, PC, May 18, 2018 
Dark SASI, PC, May 18, 2018 
Ultimate Sudoku Collection, PC, May 18, 2018 
Barrel Time Deluxe, PC, May 18, 2018 
Piopupu, PC, May 18, 2018 
S.T.R.E.T.C.H., PC, May 18, 2018 
The God, PC, May 18, 2018 
Elixir of Immortality II: The League of Immortality, PC, May 18, 2018 
Ctrl CV, PC, May 18, 2018 
Cat Food, PC, May 18, 2018 
America: Expansion Pack, PC, November 1, 2001 
Aliens Versus Predator 2, PC, October 31, 2001 
Fighting Legends, PC, October 31, 2001 
Conflict Zone, PC, October 31, 2001 
Tom Clancy's Rainbow Six Rogue Spear: Black Thorn, PC, October 31, 2001 
MechWarrior 4: Black Knight Expansion, PC, October 31, 2001 
Deadly Dozen, PC, October 31, 2001 
Search and Rescue 3, PC, October 31, 2001 
Dig Dug Deeper, PC, October 31, 2001 
Sid Meier's Civilization III, PC, October 30, 2001 
Myth III: The Wolf Age, PC, October 30, 2001 
StarLeader, PC, October 30, 2001 
4x4 EVO 2, PC, October 30, 2001 
Supercar Street Challenge, PC, October 30, 2001 
Fight Knight (2001), PC, October 30, 2001 
Motor City Online, PC, October 29, 2001 
FIFA Soccer 2002, PC, October 29, 2001 
Magic & Mayhem: The Art of Magic, PC, October 26, 2001 
Stunt GP, PC, October 25, 2001 
The War Engine, PC, October 25, 2001 
Zoombinis: Mountain Rescue, PC, October 25, 2001 
Lineage: The Blood Pledge, PC, October 24, 2001 
Beyond Atlantis II, PC, October 24, 2001 
Pursuit of Justice, PC, October 24, 2001 
Command & Conquer: Theater of War, PC, October 24, 2001 
Mat Hoffman's Pro BMX, PC, October 23, 2001 
Free Solitaire, PC, October 23, 2001 
Ballistics, PC, October 22, 2001 
Stronghold, PC, October 21, 2001 
Rugrats: All Growed-Up, PC, October 21, 2001 
Galaxy of Games: Green Edition, PC, October 21, 2001 
Flight Simulator 2002, PC, October 19, 2001 
Super Bust-A-Move, PC, October 19, 2001 
Sega GT, PC, October 19, 2001 
Blast from the Past, PC, October 19, 2001 
Christian Matchups, PC, October 19, 2001 
Schizm: Mysterious Journey, PC, October 17, 2001 
Zoo Tycoon (2001), PC, October 17, 2001 
World War III: Black Gold, PC, October 16, 2001 
Cheerios Play Time, PC, October 16, 2001 
F1 2001, PC, October 14, 2001 
Rocket Power: Extreme Arcade Games, PC, October 14, 2001 
Jack Orlando: A Cinematic Adventure, PC, October 14, 2001 
WWII Iwo Jima, PC, October 14, 2001 
Ms. Pac-Man: Quest for the Golden Maze, PC, October 12, 2001 
Super Text Twist, PC, October 12, 2001 
Moon Tycoon, PC, October 11, 2001 
From Dusk Till Dawn, PC, October 11, 2001 
Street Tennis, PC, October 11, 2001 
Command & Conquer: Red Alert 2 - Yuri's Revenge, PC, October 10, 2001 
SWAT 3: Tactical Game of the Year Edition, PC, October 10, 2001 
Battle Blitz 4 in 1 Pack, PC, October 10, 2001 
Jekyll & Hyde (2001), PC, October 9, 2001 
Zax: The Alien Hunter, PC, October 9, 2001 
Fast Food Tycoon 2, PC, October 9, 2001 
Uplink: Hacker Elite, PC, October 9, 2001 
Patrician II: Quest for Power, PC, October 8, 2001 
Project Eden, PC, October 8, 2001 
Emergency Room: Code Red, PC, October 5, 2001 
Get the Bunny, PC, October 5, 2001 
LEGO Racers 2, PC, October 4, 2001 
NHRA Drag Racing Main Event, PC, October 4, 2001 
RuneSword II, PC, October 3, 2001 
Barbie Beach Vacation, PC, October 3, 2001 
The Weakest Link, PC, October 2, 2001 
Dragon's Lair, PC, October 2, 2001 
Myth II: Worlds, PC, October 2, 2001 
Reel Deal Poker Challenge, PC, October 2, 2001 
Ultimate Ride, PC, September 30, 2001 
Skate Park Tycoon, PC, September 30, 2001 
Ski Resort Tycoon II, PC, September 30, 2001 
Acropolis: Build and Rule Ancient Greece, PC, September 29, 2001 
Williams Pinball Classics, PC, September 29, 2001 
Pool of Radiance: Ruins of Myth Drannor, PC, September 28, 2001 
Dexter's Laboratory: Science Ain't Fair, PC, September 28, 2001 
Army Men Value Pack 2, PC, September 28, 2001 
The Powerpuff Girls: Mojo Jojo's Pet Project, PC, September 28, 2001 
Field & Stream: Trophy Hunting 5, PC, September 28, 2001 
Hot Wheels: Mechanix, PC, September 27, 2001 
Ultimate Quake, PC, September 27, 2001 
Arcade Hall of Games 4-Pack, PC, September 27, 2001 
F/A-18 Precision Strike Fighter, PC, September 26, 2001 
Diablo: Battle Chest, PC, September 26, 2001 
DOOM: Collector's Edition, PC, September 26, 2001 
Doom: Collector's Edition, PC, September 26, 2001 
Quake III Gold, PC, September 26, 2001 
Hoyle Kids Games 2002, PC, September 25, 2001 
Hoyle Word Games 2002, PC, September 25, 2001 
Tonka Monster Truck, PC, September 25, 2001 
Gamer Pack, PC, September 25, 2001 
Who Wants to be a Millionaire: Kids Edition, PC, September 25, 2001 
Monopoly Tycoon, PC, September 24, 2001 
Real War, PC, September 24, 2001 
Open Kart, PC, September 24, 2001 
Harley-Davidson: Race Around the World, PC, September 24, 2001 
Throne of Darkness, PC, September 24, 2001 
SpongeBob SquarePants: Operation Krabby Patty, PC, September 24, 2001 
Vegas Fever: Winner Takes All, PC, September 24, 2001 
The Typing of the Dead, PC, September 23, 2001 
Ski-Doo X-Team Racing, PC, September 23, 2001 
The Gameshow, PC, March 13, 2019 
RagTag, PC, March 13, 2019 
Crash Landed, PC, March 13, 2019 
Mortadelo y Filemon: Una aventura de cine - Edicion especial, PC, March 13, 2019 
Prison of Word, PC, March 13, 2019 
FanaticBlader, PC, March 13, 2019 
Poggers, PC, March 13, 2019 
ELSWORD JAPAN, PC, March 13, 2019 
Let's Learn Japanese! Katakana, PC, March 13, 2019 
Tankorama, PC, March 13, 2019 
Running Ninja, PC, March 13, 2019 
Prison Escape, PC, March 13, 2019 
Dreamland Solitaire, PC, March 13, 2019 
Truberbrook: A Nerd Saves the World, PC, March 12, 2019 
Trancelation, PC, March 12, 2019 
Hypnospace Outlaw, PC, March 12, 2019 
The Caligula Effect: Overdose, PC, March 12, 2019 
7'scarlet, PC, March 12, 2019 
TheVeryHardPuzzleGame&Editor, PC, March 12, 2019 
Exocraft, PC, March 12, 2019 
Lofi Ping Pong, PC, March 12, 2019 
Robot Female Hero 1, PC, March 12, 2019 
