Title, Platform, Date 
Nobunaga's Ambition: Bushou Fuunroku, PC, March 21, 2017 
Ishin no Arashi, PC, March 21, 2017 
Romance of the Three Kingdoms IV with Power-Up Kit, PC, March 21, 2017 
Senran Kagura: Estival Versus - Dual Blooming Hearts, PC, March 21, 2017 
Maggie's Movies: Camera, Action!, PC, March 21, 2017 
Fantasy Mosaics 20: Castle of Puzzles, PC, March 21, 2017 
The Elder Scrolls: Legends, PC, March 20, 2017 
The Crow's Eye, PC, March 20, 2017 
Jackpot Poker by PokerStars, PC, March 20, 2017 
Narborion Saga, PC, March 20, 2017 
Tiles, PC, March 20, 2017 
Comit the Astrodian 2, PC, March 20, 2017 
Hotel Anatolia, PC, March 20, 2017 
Osy Osmosis, PC, March 20, 2017 
Final Rest, PC, March 20, 2017 
Princess Kidnapper 2 VR, PC, March 20, 2017 
Shadow Circuit, PC, March 20, 2017 
McOsu, PC, March 20, 2017 
Running Sausage, PC, March 19, 2017 
Myths of the World: The Black Sun, PC, March 18, 2017 
GRAY TANK, PC, March 18, 2017 
Popap, PC, March 18, 2017 
Don't Drop the Bass, PC, March 17, 2017 
NieR: Automata, PC, March 17, 2017 
Lemuria: Lost in Space, PC, March 17, 2017 
Galactic Core: The Lost Fleet, PC, March 17, 2017 
Hover Skate VR, PC, March 17, 2017 
City Siege Factions, PC, March 17, 2017 
Detective Noir, PC, March 17, 2017 
Permute, PC, March 17, 2017 
Cat Goes Platform, PC, March 17, 2017 
Senran Kagura: Estival Versus, PC, March 17, 2017 
Ascender, PC, March 17, 2017 
Tokyo Twilight Ghost Hunters: Daybreak Special Gigs, PC, March 17, 2017 
Antagonist, PC, March 17, 2017 
Macbat 64, PC, March 17, 2017 
The Tenth Line, PC, March 17, 2017 
Ecchi Sketch: Draw Cute Girls Every Day!, PC, March 17, 2017 
Viktor, a Steampunk Adventure, PC, March 17, 2017 
Adventures of Abrix, PC, March 17, 2017 
Ninja Avenger Dragon Blade, PC, March 17, 2017 
Barclay: The Marrowdale Murder, PC, March 17, 2017 
Clash of Vessels VR, PC, March 17, 2017 
SnarfQuest Tales, Episode 1: The Beginning, PC, March 17, 2017 
CTHON, PC, March 17, 2017 
Fantasy TD: Dragon Knights, PC, March 17, 2017 
Life of a Mobster, PC, March 17, 2017 
Life of a Wizard, PC, March 17, 2017 
Welcome Home, Love, PC, March 17, 2017 
The Lost Heir 3: Demon War, PC, March 17, 2017 
Violent Killer VR, PC, March 17, 2017 
RealBX VR, PC, March 17, 2017 
Trolley Gold, PC, March 17, 2017 
Warpaint, PC, March 17, 2017 
Star Hunter VR, PC, March 17, 2017 
Frontier VR, PC, March 17, 2017 
Evil, PC, March 17, 2017 
7 Crimson Duck Games, PC, March 17, 2017 
Senran Kagura: Estival Versus - Ayame, PC, March 17, 2017 
Senran Kagura: Estival Versus - Kagura, PC, March 17, 2017 
Senran Kagura: Estival Versus - Naraku, PC, March 17, 2017 
Senran Kagura: Estival Versus - Mission Pack, PC, March 17, 2017 
Senran Kagura: Estival Versus - Ikki Tosen, PC, March 17, 2017 
Crystal City: Stop The Earth, I'm Getting Off, PC, March 16, 2017 
Virtual Rides 3, PC, March 16, 2017 
Snowflake's Chance, PC, March 16, 2017 
The Keep, PC, March 16, 2017 
Waking the Glares: Chapters I and II, PC, March 16, 2017 
Train Sim World: CSX Heavy Haul, PC, March 16, 2017 
The Last Patient, PC, March 16, 2017 
64.0, PC, March 16, 2017 
Pastelia Stories, PC, March 16, 2017 
M.A.C.E., PC, March 16, 2017 
Lifeline, PC, March 16, 2017 
Clone Drone in the Danger Zone, PC, March 16, 2017 
Alien Insanity, PC, March 16, 2017 
100ft Robot Golf, PC, March 16, 2017 
Pain Train 2, PC, March 16, 2017 
The Butterfly Sign: Human Error, PC, March 16, 2017 
Cosmic Express, PC, March 16, 2017 
Last Tale, PC, March 16, 2017 
Turok 2: Seeds of Evil Remaster, PC, March 16, 2017 
The Unseen Fears: Body Thief, PC, March 16, 2017 
The Lion's Song: Episode 3 - Derivation, PC, March 16, 2017 
Gnomes Garden: New home, PC, March 16, 2017 
Future Unfolding, PC, March 15, 2017 
Heroes of Dire, PC, March 15, 2017 
Absoloot, PC, March 15, 2017 
Soul Saber 2, PC, March 15, 2017 
Space Impact Glitch, PC, March 15, 2017 
There's Poop In My Soup: Number 2, PC, March 15, 2017 
Chaos Code: New Sign of Catastrophe, PC, March 15, 2017 
Panzer Panic VR, PC, March 15, 2017 
Trianguluv, PC, March 15, 2017 
Metal Assault, PC, March 15, 2017 
Surfasaurus, PC, March 15, 2017 
Tales of Escape, PC, March 15, 2017 
Ricky Raccoon 2: Adventures in Egypt, PC, March 15, 2017 
I Love Baseball, PC, March 15, 2017 
VR Baseball, PC, March 15, 2017 
Jigsaw Puzzle Beach Season 2, PC, September 13, 2017 
Rogue Islands, PC, September 12, 2017 
Pro Evolution Soccer 2018, PC, September 12, 2017 
Tooth and Tail, PC, September 12, 2017 
NASCAR Heat 2, PC, September 12, 2017 
B.C.E., PC, September 12, 2017 
Dino Dini's Kick Off Revival, PC, September 12, 2017 
Rugby League Live 4, PC, September 12, 2017 
Hurl VR, PC, September 12, 2017 
Shopping Tycoon, PC, September 12, 2017 
The Hunt: Rebuilt, PC, September 12, 2017 
BlockGame, PC, September 12, 2017 
Better Off Tread, PC, September 12, 2017 
Trackless, PC, September 12, 2017 
Super Mr. Kake, PC, September 12, 2017 
Chinese Paladin 5, PC, September 12, 2017 
Relic Keepers, PC, September 12, 2017 
The Ultimatest Battle, PC, September 12, 2017 
Freshly fried shrimps seemed hot additionally named noth, PC, September 12, 2017 
Dragon's Lunch, PC, September 12, 2017 
ZOMBIE CAR MASSACRE, PC, September 12, 2017 
Achievement Hunter: Offensive, PC, September 12, 2017 
Achievement Hunter: Darkness 2, PC, September 12, 2017 
Nimble Fish, PC, September 12, 2017 
The Little Ball That Could, PC, September 12, 2017 
Manifest 99, PC, September 12, 2017 
Uplands Motel, PC, September 12, 2017 
Blast, PC, September 12, 2017 
DEFENDER OF EARTH VS THE ALIEN ARMADA, PC, September 12, 2017 
Crankies Workshop: Grizzbot Assembly, PC, September 12, 2017 
Edmonton Trolley Car, PC, September 12, 2017 
Resurgence, PC, September 12, 2017 
Matryoshka Strike, PC, September 12, 2017 
Deadly Animal Duel, PC, September 12, 2017 
TOREj: Red Cubes, PC, September 12, 2017 
Accel World vs. Sword Art Online: Deluxe Edition, PC, September 12, 2017 
Lost Lands: Ice Spell, PC, September 12, 2017 
Injustice 2 - Fighter Pack 2, PC, September 12, 2017 
Cursed House 4, PC, September 12, 2017 
Xianjian Qixia Zhuan 5, PC, September 12, 2017 
Bloody Zombies, PC, September 11, 2017 
Forbidden Love, PC, September 11, 2017 
Pulses: Crystal Journeys, PC, September 11, 2017 
Tower Offence!, PC, September 11, 2017 
Hard Minus, PC, September 11, 2017 
Fear Of Nightmares: Madness Descent, PC, September 11, 2017 
Rush to Adventure, PC, September 11, 2017 
Bottle_Shooter, PC, September 11, 2017 
TTV2, PC, September 11, 2017 
Water Pipeline, PC, September 11, 2017 
Sliding Blocks, PC, September 11, 2017 
Gravity At Its Finest, PC, September 11, 2017 
Gravity At Its Finest 2, PC, September 11, 2017 
Until the last, PC, September 11, 2017 
Robots: create AI, PC, September 11, 2017 
Eternal Maze, PC, September 11, 2017 
Code World, PC, September 11, 2017 
Transport Defender, PC, September 11, 2017 
His Chuunibyou Cannot Be Cured!, PC, September 11, 2017 
Chicago 1930, PC, September 11, 2017 
THORNYWAY, PC, September 10, 2017 
Decaying West, PC, September 10, 2017 
SCHOOL SIMULATOR MULTIPLAYER, PC, September 10, 2017 
Lost with Dinosaurs, PC, September 9, 2017 
Orphan's Treasure, PC, September 9, 2017 
SuperWurfels, PC, September 9, 2017 
Sable Maze: Nightmare Shadows, PC, September 9, 2017 
World War Party: Game Of Trump, PC, September 9, 2017 
The Journey: Bob's Story., PC, September 8, 2017 
Archaica: The Path Of Light, PC, September 8, 2017 
Kitten adventures in city park, PC, September 8, 2017 
Screaming Eagles, PC, September 8, 2017 
Fashioning Little Miss Lonesome, PC, September 8, 2017 
Girls and Dungeons, PC, September 8, 2017 
Vulture, PC, September 8, 2017 
Soldiers Of Freedom, PC, September 8, 2017 
KILL THE EMOJI, PC, September 8, 2017 
DAMN!, PC, September 8, 2017 
Torn Familjen, PC, September 8, 2017 
VirtuGO, PC, September 8, 2017 
2D Neon Cube, PC, September 8, 2017 
Halloweenistry, PC, September 8, 2017 
Infection Rate, PC, September 8, 2017 
Bouncing Duck Simulator, PC, September 8, 2017 
Ball 2D: Crazy Soccer, PC, September 8, 2017 
Little Dog, PC, September 8, 2017 
Guardian, PC, September 8, 2017 
Adventure Road, PC, September 8, 2017 
Trivia Vault: Super Heroes Trivia 2, PC, September 8, 2017 
Startide, PC, September 8, 2017 
Ragna Maya, PC, September 8, 2017 
Laika 2.0, PC, September 8, 2017 
Chicago 1930: The Prohibition, PC, September 8, 2017 
MSI Electric City: Core Assault, PC, September 8, 2017 
GOLDRUSHERS, PC, September 8, 2017 
VR Shooter Guns, PC, September 7, 2017 
vRhythm, PC, September 7, 2017 
Beat The Game, PC, September 7, 2017 
Please Knock on My Door, PC, September 7, 2017 
Cosmic Kites, PC, September 7, 2017 
Roads of Rome: New Generation 2, PC, November 2, 2017 
Elyse the Devil, PC, November 1, 2017 
Imperil, PC, November 1, 2017 
Color Jumper, PC, November 1, 2017 
Cottage Garden, PC, November 1, 2017 
Ninja in Training, PC, November 1, 2017 
JumpSky, PC, November 1, 2017 
Virtual Robots, PC, November 1, 2017 
AuroraBound Deluxe, PC, November 1, 2017 
Cleansuit, PC, November 1, 2017 
Merv Reborn, PC, November 1, 2017 
Wanderlust (2017), PC, November 1, 2017 
Little Busters! English Edition, PC, November 1, 2017 
Midnight Ultra, PC, November 1, 2017 
My Loved Heart, PC, November 1, 2017 
meleng, PC, November 1, 2017 
Battle of Red Cliffs VR, PC, November 1, 2017 
Kitty Rescue, PC, November 1, 2017 
Mulletman and the Molemen, PC, November 1, 2017 
Soundscape, PC, November 1, 2017 
Pixelord, PC, November 1, 2017 
Expelled, PC, November 1, 2017 
Softened Cookie, PC, November 1, 2017 
BANANO BROS., PC, November 1, 2017 
Grand Pskov Story, PC, November 1, 2017 
The Grimsworth Reports: Woodfall, PC, November 1, 2017 
ALVAROK, PC, November 1, 2017 
The last strategist, PC, November 1, 2017 
Talk to Aya, PC, November 1, 2017 
Protect your planet, PC, November 1, 2017 
Achievement Lurker: Respectable Accomplishment, PC, November 1, 2017 
The Adventures of Sam Carlisle: The Hunt for the Lost Treasure, PC, November 1, 2017 
Protect Me, PC, November 1, 2017 
Dyana Moto, PC, November 1, 2017 
Gems, PC, November 1, 2017 
Enceladus, PC, November 1, 2017 
Motorsport Manager: Endurance Series, PC, November 1, 2017 
Legendary Arcane, PC, November 1, 2017 
ChemCaper: Act I - Petticles in Peril, PC, November 1, 2017 
Yago, the Coquerrestrial, PC, November 1, 2017 
Living Legends: Uninvited Guests, PC, November 1, 2017 
War Planet Online: Global Conquest, PC, November 1, 2017 
Oh My Cooking Gun, PC, November 1, 2017 
Wormix, PC, November 1, 2017 
Jaywalker, PC, November 1, 2017 
Attentat 1942, PC, October 31, 2017 
Bubsy: The Woolies Strike Back, PC, October 31, 2017 
Zoo Tycoon: Ultimate Animal Collection, PC, October 31, 2017 
Mutant Football League, PC, October 31, 2017 
Zwei: The Ilvard Insurrection, PC, October 31, 2017 
Enshrouded World, PC, October 31, 2017 
TENET, PC, October 31, 2017 
Super Man Or Monster, PC, October 31, 2017 
You Must be 18 or Older to Enter, PC, October 31, 2017 
SojournVR, PC, October 31, 2017 
LSD (Tranquility Games), PC, October 31, 2017 
Creeping Terror, PC, October 31, 2017 
Armed Warrior VR, PC, October 31, 2017 
Tetsudou Untenshi VR, PC, October 31, 2017 
WN, PC, October 31, 2017 
Chapter I: First steps, PC, October 31, 2017 
Lines Free by Nestor Yavorskyy, PC, October 31, 2017 
EMERGENCY 20, PC, October 31, 2017 
Forever Home, PC, October 31, 2017 
Pixel Car, PC, October 31, 2017 
Space Chaos, PC, October 31, 2017 
Wandering in space, PC, October 31, 2017 
Halloween Knight, PC, October 31, 2017 
SightLineVR, PC, October 31, 2017 
Time Killers: CatchOut, PC, October 31, 2017 
Task is to Survive, PC, October 31, 2017 
The Survival Test VR: Defend To Death, PC, October 31, 2017 
8-Bit Adventure Anthology: Volume One, PC, October 31, 2017 
Gold key, PC, October 31, 2017 
Epic PVP Castles, PC, October 31, 2017 
Taking Valhalla VR, PC, October 31, 2017 
Funball Games VR, PC, October 31, 2017 
Mover, PC, October 31, 2017 
O'Fox Life, PC, October 31, 2017 
Goro 2, PC, October 31, 2017 
Kink, PC, October 31, 2017 
Love all you have left, PC, October 31, 2017 
Elder Chaos, PC, October 31, 2017 
Fractus, PC, October 31, 2017 
Cow Milking Simulator, PC, October 31, 2017 
Kokoda VR, PC, October 31, 2017 
OneHit, PC, October 31, 2017 
VOID (2017), PC, October 31, 2017 
Knight Terrors, PC, October 31, 2017 
Blue Whale, PC, October 31, 2017 
Face Your Fears: Stranger Things, PC, October 31, 2017 
Cellz, PC, October 31, 2017 
Perceptions of the Dead, PC, October 31, 2017 
Dead Forest (2017), PC, October 31, 2017 
Mystery Solitaire: The Black Raven, PC, October 31, 2017 
Jewel Match Twilight Solitaire, PC, October 31, 2017 
Witch's Tales, PC, October 31, 2017 
Steampunk Graveyard, PC, October 31, 2017 
SIMULACRA: Pipe Dreams, PC, October 31, 2017 
Spintires: MudRunner, PC, October 30, 2017 
Vampire's Slave, PC, February 21, 2021 
ONNANOKO KEEPER 2, PC, February 21, 2021 
Human Or Virus, PC, February 20, 2021 
Cyber Girl, PC, February 20, 2021 
Kazakh 'Jack, PC, February 20, 2021 
Ninety Days, PC, February 20, 2021 
Elder Puzzle, PC, February 20, 2021 
Iron Survival, PC, February 20, 2021 
Snow Wars, PC, February 20, 2021 
Winning Love by Daylight, PC, February 20, 2021 
Gravity Heroes, PC, February 19, 2021 
Voyage, PC, February 19, 2021 
Volt Patrol, PC, February 19, 2021 
False Myth, PC, February 19, 2021 
THE SHORE, PC, February 19, 2021 
Ronin: Two Souls One Body, PC, February 19, 2021 
TinyShot, PC, February 19, 2021 
Fox face kills!, PC, February 19, 2021 
S.U.M. - Slay Uncool Monsters, PC, February 19, 2021 
Dating Life: Emily X Miley, PC, February 19, 2021 
Alien AI, PC, February 19, 2021 
Joy the Pug, PC, February 19, 2021 
We're All Going To Die, PC, February 19, 2021 
Survival RPG 3: Lost in time, PC, February 19, 2021 
Devil Girl, PC, February 19, 2021 
EXOTIUM - Episode 8, PC, February 19, 2021 
Blackstar, PC, February 19, 2021 
Slender Hentai Edition, PC, February 19, 2021 
Legend of Empires, PC, February 19, 2021 
Horatama, PC, February 19, 2021 
Darkness Under My Bed, PC, February 19, 2021 
Lucid Cycle, PC, February 19, 2021 
STRAY KITTEN, PC, February 19, 2021 
Shoot Your Friends, PC, February 19, 2021 
Hentai Nureta Puzzle Mythica, PC, February 19, 2021 
Visiting a celebrity, PC, February 19, 2021 
Quick Race, PC, February 19, 2021 
Analytical World, PC, February 19, 2021 
Demon Zombie Outpost, PC, February 19, 2021 
Bookshelf, PC, February 19, 2021 
BOOOOOOOOOOOOOOOUNCE, PC, February 19, 2021 
VR Spaceship Battle, PC, February 19, 2021 
Gangster War, PC, February 19, 2021 
Block Dungeon, PC, February 19, 2021 
Garetto, PC, February 19, 2021 
Muffin Fight, PC, February 19, 2021 
Kosmonavtes: Escape Reality, PC, February 19, 2021 
Plot of the Druid: Nightwatch, PC, February 19, 2021 
ALTF4, PC, February 19, 2021 
FoxPaww, PC, February 19, 2021 
Luxury GIRLS, PC, February 19, 2021 
CHACAL, PC, February 19, 2021 
Worn Thin, PC, February 19, 2021 
Lama Azavtani, PC, February 19, 2021 
Commandos Pro Simulator, PC, February 19, 2021 
Key Pattern Trading Card TCG, PC, February 19, 2021 
Steven Universe: Unleash the Light, PC, February 19, 2021 
Dots n Lines, PC, February 19, 2021 
The Death of Zoe, PC, February 19, 2021 
Blizzard Arcade Collection, PC, February 19, 2021 
Rocket Assault, PC, February 18, 2021 
Dis The Game, PC, February 18, 2021 
Mutropolis, PC, February 18, 2021 
After I met that catgirl, my questlist got too long!, PC, February 18, 2021 
ETERNAL BLOOD, PC, February 18, 2021 
Warhammer 40,000: Dakka Squadron, PC, February 18, 2021 
Natsuki Chronicles, PC, February 18, 2021 
Buddy Simulator 1984, PC, February 18, 2021 
Nerve, PC, February 18, 2021 
Lemon Cake, PC, February 18, 2021 
House Flipper: The Luxury, PC, February 18, 2021 
Trader Life Simulator, PC, February 18, 2021 
Space Dance Harmony, PC, February 18, 2021 
Negative: The Way of Shinobi, PC, February 18, 2021 
Inversion (Dnovel), PC, February 18, 2021 
Glam, PC, February 18, 2021 
Hatchpunk, PC, February 18, 2021 
My Dream Sport Dating Simulator, PC, February 18, 2021 
AmIHero, PC, February 18, 2021 
Earth Elements, PC, February 18, 2021 
Sun Meiqi Mystery Season 5, PC, February 18, 2021 
The Damathos Clan, PC, February 18, 2021 
Heart of Siam, PC, February 18, 2021 
The Light of Summer, PC, February 18, 2021 
Fantasy Tavern Sextet ~ Vol. 2 Adventurer's Days ~, PC, February 18, 2021 
Hit N' Rush, PC, February 18, 2021 
Pamir Saga, PC, February 18, 2021 
Woodle Deluxe, PC, February 18, 2021 
Learn Programming: Python, PC, February 18, 2021 
Legacy - Witch Island 3, PC, February 18, 2021 
Zero-G Revolution, PC, February 18, 2021 
Formula Bit Racing, PC, February 18, 2021 
Time to GOLF, PC, February 18, 2021 
DreamCatcher: Reflections Volume 1, PC, February 18, 2021 
Physics car FOREVER, PC, February 18, 2021 
Devil Slayer, PC, February 18, 2021 
Discovery Yard Police, PC, February 18, 2021 
aMAZE Gears 3, PC, February 18, 2021 
Researcher, PC, February 18, 2021 
ZenFarm, PC, February 18, 2021 
London Detective Mysteria, PC, July 31, 2019 
Pilot Sports, PC, July 31, 2019 
Pumpkin Days, PC, July 31, 2019 
Doughlings: Invasion, PC, July 31, 2019 
Dragonbell, PC, July 31, 2019 
Easy hentai puzzle, PC, July 31, 2019 
My University Story, PC, July 31, 2019 
Bear With Me: The Complete Collection, PC, July 31, 2019 
Tanks Endeavour, PC, July 31, 2019 
Resistance is Fruitile, PC, July 31, 2019 
Visitor2, PC, July 31, 2019 
Rick Rack, PC, July 31, 2019 
Streamer's Life, PC, July 31, 2019 
Dating Life: Miley X Emily, PC, July 31, 2019 
John's Wizard Dungeon, PC, July 31, 2019 
Layers Of The Machine, PC, July 31, 2019 
Escargot, PC, July 31, 2019 
War Tenshi, PC, July 31, 2019 
Mini Tekton, PC, July 31, 2019 
Room 40, PC, July 31, 2019 
The Cross Horror Game, PC, July 31, 2019 
Crystal Crisis, PC, July 31, 2019 
Crystal Defense, PC, July 31, 2019 
Chasing Nebula, PC, July 31, 2019 
Polyrun, PC, July 31, 2019 
Artifact Adventure Gaiden DX, PC, July 31, 2019 
Sniper Commando Attack, PC, July 31, 2019 
Rumia in the darkness, PC, July 31, 2019 
Mighty Gunvolt Burst, PC, July 31, 2019 
Ace Combat 7: Skies Unknown - DLC Package #3, PC, July 31, 2019 
Roman Adventures: Britons - Season Two, PC, July 31, 2019 
Oxygen Not Included, PC, July 30, 2019 
Atmocity, PC, July 30, 2019 
Towertale, PC, July 30, 2019 
Morphies Law, PC, July 30, 2019 
The Five Cores Remastered, PC, July 30, 2019 
Codex Temondera: Lost Vision, PC, July 30, 2019 
A Short Hike, PC, July 30, 2019 
Bear With Me: The Lost Robots, PC, July 30, 2019 
Cricket 19: Official Game of the Ashes, PC, July 30, 2019 
Warhammer 40,000: Inquisitor - Martyr: Prophecy, PC, July 30, 2019 
Variables, PC, July 30, 2019 
Mutant Year Zero: Road to Eden - Seed of Evil, PC, July 30, 2019 
War Solution, PC, July 30, 2019 
BLAST-AXIS, PC, July 30, 2019 
Rolly's Adventure, PC, July 30, 2019 
1000$, PC, July 30, 2019 
Corpse Killer: 25th Anniversary Edition, PC, July 30, 2019 
Cryptographer, PC, July 30, 2019 
Custom Order Maid 3D2 ~ It's a Night Magic ~, PC, July 30, 2019 
Anticorps VR, PC, July 30, 2019 
Lunch A Palooza, PC, July 30, 2019 
Morphies Law: Remorphed, PC, July 30, 2019 
Triangulum, PC, July 30, 2019 
Pirouette, PC, July 30, 2019 
Witch College, PC, July 30, 2019 
Everyone Goes Home, PC, July 30, 2019 
Guns Color Pixel Art, PC, July 30, 2019 
Counterspell, PC, July 30, 2019 
ChatAid, PC, July 30, 2019 
CENTRALIA, PC, July 30, 2019 
G.A.M.E.S, PC, July 30, 2019 
You Don't Have Time, PC, July 30, 2019 
Stop it - Driving Simulation, PC, July 30, 2019 
Hentai Inumimi, PC, July 30, 2019 
Hentai Shojo, PC, July 30, 2019 
Rou Ita Kouryaku, PC, July 30, 2019 
Fushi Immortal, PC, July 30, 2019 
Fight For Freedom, PC, July 30, 2019 
Dream Keeper, PC, July 30, 2019 
Raiders of the North Sea, PC, July 30, 2019 
The Chronicles of Confucius's Journey, PC, July 30, 2019 
We Happy Few: Lightbearer, PC, July 30, 2019 
Anno 1800: Sunken Treasure, PC, July 30, 2019 
The Blackout Club, PC, July 29, 2019 
In the world end, You and me the forget's legend, PC, July 29, 2019 
Run Jump Rabbit Turtle, PC, July 29, 2019 
Deathless Dungeon, PC, July 29, 2019 
Kindergarten 2, PC, July 29, 2019 
STRASHILKA, PC, July 29, 2019 
Image of Perfection, PC, July 29, 2019 
Hentai Mosaique Fix-IT Shoppe, PC, July 29, 2019 
Mini Tone Puzzle, PC, July 29, 2019 
Don't Escape Trilogy, PC, July 29, 2019 
Virtual Cast, PC, July 29, 2019 
Violet rE:-The Final reExistence-, PC, July 29, 2019 
Pictures of Life, PC, July 29, 2019 
Budo Girl War - Maid, PC, July 29, 2019 
The Designer's Curse, PC, July 29, 2019 
Kakuro, PC, July 29, 2019 
Tricky Cow, PC, July 29, 2019 
ROAD HOMEWARD 3 underwater world, PC, July 29, 2019 
Baldina's Basis in Education Literary Grammar, PC, July 29, 2019 
Robot Female Hero 2, PC, July 29, 2019 
Kaori Yama 31 Gou, PC, July 29, 2019 
Hyacinthus, PC, July 28, 2019 
Cockatrice Attacking the city, PC, July 28, 2019 
Hotel Ever After - Ella's Wish, PC, July 27, 2019 
WBTR, PC, July 27, 2019 
C64 & AMIGA Classix Remakes Sixpack 3, PC, July 27, 2019 
Heroes of SoulCraft - Arcade MOBA, PC, July 20, 2015 
Big Fish Legend, PC, July 20, 2015 
Claws & Feathers 2, PC, July 20, 2015 
Civilization Online, PC, July 18, 2015 
Shrouded Tales: Revenge of Shadows, PC, July 18, 2015 
Executive Assault, PC, July 17, 2015 
Cosmic Rocket Defender, PC, July 17, 2015 
Niko: Through The Dream, PC, July 17, 2015 
Interstellaria, PC, July 17, 2015 
Aberoth, PC, July 17, 2015 
In Space We Brawl, PC, July 17, 2015 
Champion of the Gods, PC, July 17, 2015 
Vortex, PC, July 17, 2015 
Tap Tap Infinity, PC, July 17, 2015 
Super Dungeon Run, PC, July 17, 2015 
Paintball eXtreme, PC, July 17, 2015 
Brighter Day, PC, July 17, 2015 
Gunbird, PC, July 17, 2015 
No Time To Explain Remastered, PC, July 17, 2015 
Choice Chamber, PC, July 16, 2015 
Sorcerer King, PC, July 16, 2015 
Legions of Steel, PC, July 16, 2015 
Luckslinger, PC, July 16, 2015 
Worms World Party Remastered, PC, July 16, 2015 
Badland Bandits, PC, July 16, 2015 
MechaNika, PC, July 16, 2015 
Temporal Shift, PC, July 16, 2015 
Squarelands, PC, July 16, 2015 
Soccer Manager 2015, PC, July 16, 2015 
RC Mini Racers, PC, July 16, 2015 
Ninjahtic Mind Tricks, PC, July 16, 2015 
Payday 2: Gage Ninja Pack, PC, July 16, 2015 
Shadow Wolf Mysteries: Tracks of Terror, PC, July 16, 2015 
Amygdala, PC, July 15, 2015 
Energy Heroes, PC, July 15, 2015 
DGU, PC, July 15, 2015 
Axis Football 2015, PC, July 15, 2015 
A Mass of Dead, PC, July 15, 2015 
Odallus: The Dark Call, PC, July 15, 2015 
AntharioN, PC, July 15, 2015 
SEEP Universe, PC, July 15, 2015 
Anti-Opoly, PC, July 15, 2015 
Assault Corps 2, PC, July 15, 2015 
Tachyon Project, PC, July 15, 2015 
Pinball FX 2: Marvel's Ant-Man, PC, July 15, 2015 
Brownies, PC, July 15, 2015 
Guild of Dungeoneering, PC, July 14, 2015 
Trials Fusion: Awesome Level Max, PC, July 14, 2015 
Nomad Fleet, PC, July 14, 2015 
AR-K Episode 3: The Great Escape, PC, July 14, 2015 
DRIFT 84, PC, July 14, 2015 
Siegelord, PC, July 14, 2015 
Crusader Kings II: Horse Lords, PC, July 14, 2015 
Karma, PC, July 14, 2015 
Jet Racing Extreme, PC, July 14, 2015 
The Sims 4: Spa Day, PC, July 14, 2015 
2D Mahjong Temple, PC, July 14, 2015 
Dream (2013), PC, July 13, 2015 
Holy Potatoes! A Weapon Shop?!, PC, July 13, 2015 
Fighties, PC, July 13, 2015 
Card Hunter, PC, July 13, 2015 
Slybots: Frantic Zone, PC, July 13, 2015 
Hack Run ZERO, PC, July 13, 2015 
The Land Of Lamia, PC, July 13, 2015 
The Hole Story, PC, July 13, 2015 
Rake, PC, July 13, 2015 
Card Hunter: Expedition to the Sky Citadel, PC, July 13, 2015 
RPG Maker 2000, PC, July 13, 2015 
Amazing Gift, PC, July 13, 2015 
Subliminal Realms: The Masterpiece, PC, July 11, 2015 
Mactabilis, PC, July 10, 2015 
Monster Truck Destruction, PC, July 10, 2015 
Railroad Lines, PC, July 10, 2015 
Mystery Maze Of Balthasar Castle, PC, July 10, 2015 
Spectra (2015), PC, July 10, 2015 
How to Take Off Your Mask, PC, July 10, 2015 
Contradiction - Spot The Liar!, PC, July 10, 2015 
Hordelicious, PC, July 10, 2015 
Street Arena, PC, July 10, 2015 
Trap Them, PC, July 10, 2015 
Zombie Party, PC, July 10, 2015 
TeraBlaster, PC, July 10, 2015 
Pilot Crusader, PC, July 10, 2015 
ATV GP, PC, July 10, 2015 
After The End: The Harvest, PC, July 10, 2015 
Path of Exile: The Awakening, PC, July 10, 2015 
Face It, PC, July 9, 2015 
The Red Solstice, PC, July 9, 2015 
Traverser, PC, July 9, 2015 
F1 2015, PC, July 9, 2015 
The Magic Circle, PC, July 9, 2015 
Trove, PC, July 9, 2015 
Cosmophony, PC, July 9, 2015 
Hello Kitty and Sanrio Friends Racing, PC, July 9, 2015 
Replay: VHS is not dead, PC, July 9, 2015 
The Language Game, PC, July 9, 2015 
Pulut Adventure, PC, July 9, 2015 
Epic Cards Battle, PC, July 9, 2015 
Phantasmat: The Dread of Oakville, PC, July 9, 2015 
Fantasy Mosaics 9: Portal in the Woods, PC, July 9, 2015 
A Hole New World, PC, May 19, 2017 
The Infectious Madness of Doctor Dekker, PC, May 19, 2017 
The Slopes, PC, May 19, 2017 
Voxel Shot VR, PC, May 19, 2017 
Oafmatch, PC, May 19, 2017 
Nongunz, PC, May 19, 2017 
Lazaretto, PC, May 19, 2017 
sphereFACE, PC, May 19, 2017 
Vision Origin, PC, May 19, 2017 
Slippy Slug, PC, May 19, 2017 
Cyberhunt, PC, May 19, 2017 
Bionic Attack, PC, May 19, 2017 
RUN (2017), PC, May 19, 2017 
Saishoku Shoujo: Fuufu Seikatsu, Hajime Masu, PC, May 19, 2017 
Watch Dogs 2: No Compromise, PC, May 18, 2017 
Regalia: Of Men and Monarchs, PC, May 18, 2017 
Detached, PC, May 18, 2017 
Portal Knights, PC, May 18, 2017 
Mages of Mystralia, PC, May 18, 2017 
Inner Chains, PC, May 18, 2017 
To the Top, PC, May 18, 2017 
Reservoir Dogs: Bloody Days, PC, May 18, 2017 
Mystery Mine, PC, May 18, 2017 
Call of Duty: Infinite Warfare - Continuum, PC, May 18, 2017 
The Falling Nights, PC, May 18, 2017 
Omnom Necropolis, PC, May 18, 2017 
Little Lords of Twilight, PC, May 18, 2017 
Neverout, PC, May 18, 2017 
Journey Of Johann, PC, May 18, 2017 
Rise of Balloons, PC, May 18, 2017 
