Title, Platform, Date 
The Chronicles of Emerland Solitaire, PC, September 15, 2012 
FTL: Faster Than Light, PC, September 14, 2012 
Loren the Amazon Princess: The Castle of N'mar, PC, September 14, 2012 
Tryst, PC, September 14, 2012 
Black Mesa, PC, September 14, 2012 
Smooth Operators, PC, September 14, 2012 
Oddworld: Stranger's Wrath HD, PC, September 14, 2012 
Kodzukuri Youkai H Henka, PC, September 14, 2012 
The Agency of Anomalies: The Last Performance, PC, September 14, 2012 
Continent of the Ninth Seal, PC, September 13, 2012 
Secret Files 3, PC, September 13, 2012 
Might & Magic: Duel of Champions, PC, September 13, 2012 
Take On Helicopters: Rearmed, PC, September 13, 2012 
Hoodwink Ep1: The Brute, The Babe and The Bogey, PC, September 13, 2012 
Crazy Fairies, PC, September 13, 2012 
Middens, PC, September 13, 2012 
Gateways, PC, September 12, 2012 
Red Johnson's Chronicles - One Against All, PC, September 12, 2012 
Tom Clancy's Ghost Recon Online - The Arctic Pack, PC, September 12, 2012 
Wrack, PC, September 12, 2012 
ArmA II: Army of the Czech Republic, PC, September 12, 2012 
Fibrillation, PC, September 12, 2012 
Vox, PC, September 12, 2012 
Boutique Boulevard, PC, September 12, 2012 
Battlefield 3: Armored Kill, PC, September 11, 2012 
Transcripted, PC, September 11, 2012 
Transformers: Fall of Cybertron - Dinobot Destructor Pack, PC, September 11, 2012 
Swedish Indie Pack, PC, September 11, 2012 
Critter Crunch, PC, September 11, 2012 
Deez, PC, December 26, 2018 
Queen's Garden Christmas, PC, December 26, 2018 
Rhythm Nights, PC, December 26, 2018 
Eat Your Words, PC, December 25, 2018 
Take That, PC, December 25, 2018 
Lady's Hentai Mosaic, PC, December 25, 2018 
Yuyue Konghua, PC, December 25, 2018 
Miracle snack shop, PC, December 25, 2018 
Abstract Hell, PC, December 25, 2018 
Buttle Tank, PC, December 25, 2018 
Magnesia, PC, December 25, 2018 
PROEBALL, PC, December 25, 2018 
Tempest of the Heavens and Earth, PC, December 25, 2018 
Shaoye, PC, December 25, 2018 
BLASTER LiLO, PC, December 25, 2018 
Jake and the Giant, PC, December 24, 2018 
Sayaka Relaunched, PC, December 24, 2018 
Singularity Shooter, PC, December 24, 2018 
1001 Jigsaw. Legends of Mystery, PC, December 24, 2018 
Tower Defense 2D: Impossible, PC, December 24, 2018 
The Scenic Treasures - Japanese Learning, PC, December 24, 2018 
Sudoku3D, PC, December 24, 2018 
Girls & sweets, PC, December 24, 2018 
Impulsow, PC, December 24, 2018 
Bubble Burst, PC, December 24, 2018 
Paradigm Blast, PC, December 24, 2018 
Orc Towers VR, PC, December 24, 2018 
Dragon Racer, PC, December 24, 2018 
Data mining 4, PC, December 24, 2018 
Northern Tales, PC, December 24, 2018 
Ultimate Legends, PC, December 24, 2018 
Stary, PC, December 24, 2018 
Adult Math, PC, December 24, 2018 
The Colony (Monkeystein Games), PC, December 24, 2018 
Scream of the Viking, PC, December 24, 2018 
Where is Santa?, PC, December 24, 2018 
Scream of the Viking 2, PC, December 24, 2018 
Fantasy Mosaics 32: Santa's Hut, PC, December 24, 2018 
The Chronicles of King Arthur - Episode 1: Excalibur, PC, December 23, 2018 
Chain Reaction : Sexy Hentai Girls, PC, December 23, 2018 
The Seduction of Shaqeera, PC, December 23, 2018 
The Chronicles of King Arthur: Episode 1 - Excalibur, PC, December 23, 2018 
Christmas at Morleyville Mall, PC, December 22, 2018 
Intrepid, PC, December 22, 2018 
The Emulator, PC, December 22, 2018 
Evolo.The Sun, PC, December 22, 2018 
12 Labours of Hercules VIII: How I Met Megara, PC, December 22, 2018 
Hiking Simulator 2018, PC, December 21, 2018 
103, PC, December 21, 2018 
JUMP UP, PC, December 21, 2018 
SEQUENCE STORM, PC, December 21, 2018 
Ilhumia, PC, December 21, 2018 
POLYBIUS, PC, December 21, 2018 
Epic of Serinor: Dawnshadow, PC, December 21, 2018 
Minotaur Arcade Volume 1, PC, December 21, 2018 
AREA 4643, PC, December 21, 2018 
Duality, PC, December 21, 2018 
Olea's Descent, PC, December 21, 2018 
They That Feast, PC, December 21, 2018 
Inclement, PC, December 21, 2018 
The Blame, PC, December 21, 2018 
The Ghost of You, PC, December 21, 2018 
Greedy Crush, PC, December 21, 2018 
Chinese Driving License Test, PC, December 21, 2018 
Chieftain, PC, December 21, 2018 
Jewel Match Solitaire Winterscapes, PC, December 21, 2018 
MonGirlTile, PC, December 21, 2018 
GACHIMUCHI Arcade: Lustful Boys, PC, December 21, 2018 
Jump & Shoot, PC, December 21, 2018 
Singularity 5, PC, December 21, 2018 
Pogo, PC, December 21, 2018 
Hentai Hexa Puzzle, PC, December 21, 2018 
Star Destroyer, PC, December 21, 2018 
HIS-Origin, PC, December 21, 2018 
Tap Cats: Battle Arena, PC, December 21, 2018 
Parker & Lane: Twisted Minds, PC, December 21, 2018 
Football Manager 2019: The Hashtag United Challenge, PC, December 21, 2018 
Big Bash Boom, PC, December 20, 2018 
Red and Yellow, PC, December 20, 2018 
One touch, PC, December 20, 2018 
Hypergate, PC, December 20, 2018 
Balloon guy, PC, December 20, 2018 
Cherry in the Sky, PC, December 20, 2018 
Kunio-kun: The World Classics Collection, PC, December 20, 2018 
Christmas Mahjong 2, PC, December 20, 2018 
A Front Too Far: Normandy, PC, December 20, 2018 
Zup! Arena, PC, December 20, 2018 
Tales From Windy Meadow, PC, December 20, 2018 
The Clean Up Clyde Collection, PC, December 20, 2018 
Danger!Energy, PC, December 20, 2018 
Color Knight, PC, December 20, 2018 
Burnt Rubber, PC, December 20, 2018 
Strike of Horror, PC, December 20, 2018 
Leopoldo Manquiseil, PC, December 20, 2018 
Bohrdom, PC, December 20, 2018 
ToyShot VR, PC, December 20, 2018 
Crashy Racing, PC, December 20, 2018 
After Hours, PC, December 20, 2018 
Three Kingdoms Ancient Strategy, PC, December 20, 2018 
Change : A Little Story, PC, December 20, 2018 
Saga of the Void : Admirals, PC, August 16, 2017 
Aircar, PC, August 16, 2017 
Agents of Mayhem, PC, August 15, 2017 
Observer, PC, August 15, 2017 
Eliosi's Hunt, PC, August 15, 2017 
Sonic Mania, PC, August 15, 2017 
Nidhogg 2, PC, August 15, 2017 
Ken Follett's The Pillars of the Earth, PC, August 15, 2017 
>observer_, PC, August 15, 2017 
ChainMan, PC, August 15, 2017 
Luna (2017), PC, August 15, 2017 
PHAT STACKS 2, PC, August 15, 2017 
The Chronicles of Dragon Wing: Reborn, PC, August 15, 2017 
ExZeus 2, PC, August 15, 2017 
The Trail: Frontier Challenge, PC, August 15, 2017 
Outracer, PC, August 15, 2017 
dontbegrey, PC, August 15, 2017 
Song Samurai, PC, August 15, 2017 
Insanity VR: Last Score, PC, August 15, 2017 
Trivia Vault: Super Heroes Trivia, PC, August 15, 2017 
Detrita Battlegrounds, PC, August 15, 2017 
Defenders of Ekron, PC, August 15, 2017 
Soldier Killer, PC, August 15, 2017 
80.08, PC, August 15, 2017 
Call Me Skyfish, PC, August 15, 2017 
Avoid The Monsters, PC, August 15, 2017 
Twisted: Enhanced Edition, PC, August 15, 2017 
Youtubers Clicker, PC, August 15, 2017 
Joy Pony, PC, August 15, 2017 
FlatFatCat, PC, August 15, 2017 
Magic Pixel Picross, PC, August 15, 2017 
Tower And Guardian, PC, August 15, 2017 
Ancient Battle: Rome, PC, August 15, 2017 
Minecraft: Story Mode Season Two - Episode 2: Giant Consequences, PC, August 15, 2017 
Dungeon Manager ZV: Resurrection, PC, August 15, 2017 
Crushing Blow, PC, August 15, 2017 
Lethal Laser, PC, August 15, 2017 
AEGYPTUS, PC, August 15, 2017 
Roaring Twenties Solitaire, PC, August 15, 2017 
Starcraft Remastered, PC, August 14, 2017 
Pine Seekers, PC, August 14, 2017 
Dark Mystery, PC, August 14, 2017 
SOULS, PC, August 14, 2017 
Space Scumbags, PC, August 14, 2017 
Trivia Vault: Science & History Trivia, PC, August 14, 2017 
The Exorcist (2017), PC, August 14, 2017 
The soldier in the mine, PC, August 14, 2017 
ArkanoidSmoking, PC, August 14, 2017 
Carnival Ball, PC, August 14, 2017 
Nightmare at the lighthouse, PC, August 14, 2017 
Red Number: Prologue, PC, August 14, 2017 
Tale of Wuxia:The Pre-Sequel, PC, August 14, 2017 
Dumb Stone Card Game, PC, August 14, 2017 
IsoBoom, PC, August 14, 2017 
Mayhem Above, PC, August 14, 2017 
Beetlejuice: Bad as Can, PC, August 14, 2017 
EXON: The Impossible Challenge, PC, August 14, 2017 
Ice Crystal Adventure, PC, August 14, 2017 
Singularity Roller, PC, August 13, 2017 
Plandzz, PC, August 12, 2017 
Stickman Wars, PC, August 12, 2017 
Ruthless Safari, PC, August 12, 2017 
Connected Hearts, PC, August 12, 2017 
Maze: Nightmare Realm, PC, August 12, 2017 
Sudden Strike 4, PC, August 11, 2017 
Code 7, PC, August 11, 2017 
Gotta Go, PC, August 11, 2017 
Cutthroat Gunboat, PC, August 11, 2017 
The Heiress, PC, August 11, 2017 
ICY: Frostbite Edition, PC, August 11, 2017 
Supermagical, PC, August 11, 2017 
Kama Bullet Heritage, PC, August 11, 2017 
Z69, PC, August 11, 2017 
Deadly Rescue, PC, August 11, 2017 
C64 & AMIGA Classix Remakes Sixpack, PC, August 11, 2017 
Heroes of Civilizations, PC, August 11, 2017 
Last Soldier, PC, August 11, 2017 
Animal Crush, PC, August 11, 2017 
OutSplit, PC, August 11, 2017 
Vault Resort, PC, August 11, 2017 
Dead Horizon, PC, August 11, 2017 
Night Trap: 25th Anniversary Edition, PC, August 11, 2017 
I Want Toilet!!!!!!, PC, August 11, 2017 
SturmFront: The Mutant War - Ubel Edition, PC, August 11, 2017 
Trivia Vault: Mixed Trivia, PC, August 11, 2017 
Pain Train PainPocalypse, PC, August 11, 2017 
Triangulate, PC, August 11, 2017 
I.F.O, PC, August 11, 2017 
Leon's crusade, PC, August 11, 2017 
Dragon's Dungeon: Awakening, PC, August 11, 2017 
Life on Mars Remake, PC, August 11, 2017 
Taras Bulba and platforms of Hoolion, PC, August 11, 2017 
Equalizer, PC, August 11, 2017 
Co-Co CORN MAFIA, PC, August 11, 2017 
Crystal Mosaic, PC, August 11, 2017 
Total War: WARHAMMER - Norsca Race Pack, PC, August 10, 2017 
Hearthstone: Heroes of Warcraft - Knights of the Frozen Throne, PC, August 10, 2017 
West of Loathing, PC, August 10, 2017 
From Shadows, PC, August 10, 2017 
Time Recoil, PC, August 10, 2017 
Macroboy Y, PC, July 19, 2018 
Mary Skelter: Nightmares, PC, July 19, 2018 
Sweet Girl Adventure 2, PC, July 19, 2018 
Grim Tales: The Hunger, PC, July 19, 2018 
HOLONGLIDE, PC, July 19, 2018 
Not Without You, PC, July 19, 2018 
Poker VR, PC, July 19, 2018 
The Tower of Beatrice, PC, July 18, 2018 
Achaem, PC, July 18, 2018 
Ninja SpeedRush, PC, July 18, 2018 
Kitanai Doyoubi no Seikatsu, PC, July 18, 2018 
Night of the Shrub Part 2, PC, July 18, 2018 
BAD DAY (Factory 64 Games), PC, July 18, 2018 
Glitch, PC, July 18, 2018 
Forgotten World, PC, July 18, 2018 
Emily's Adventure, PC, July 18, 2018 
Aeroplanoui, PC, July 18, 2018 
Koikoi, PC, July 18, 2018 
Gotcha Racing 2nd, PC, July 18, 2018 
ZYX STORY, PC, July 18, 2018 
Viki Spotter: Camping, PC, July 18, 2018 
NightmareBullet, PC, July 18, 2018 
PIDO1, PC, July 18, 2018 
TimeCluster, PC, July 18, 2018 
Dead by Death, PC, July 18, 2018 
Space Explorers: Reload, PC, July 18, 2018 
Type Defense, PC, July 18, 2018 
Goalkeeper Legend, PC, July 18, 2018 
Faeria: Fall of Everlife, PC, July 18, 2018 
Asphalt 9: Legends, PC, July 18, 2018 
Adventure Time: Pirates of the Enchiridion, PC, July 17, 2018 
Tempest 4000, PC, July 17, 2018 
Mothergunship, PC, July 17, 2018 
The Path of Motus, PC, July 17, 2018 
Mugsters, PC, July 17, 2018 
Far Cry 5: Lost on Mars, PC, July 17, 2018 
Naked Sun, PC, July 17, 2018 
Chicken Assassin: Reloaded, PC, July 17, 2018 
Sweet Treats, PC, July 17, 2018 
TRAGO, PC, July 17, 2018 
Shadowlings, PC, July 17, 2018 
Groove Coaster for Steam, PC, July 17, 2018 
Reveal, PC, July 17, 2018 
The Journey to Fairytales, PC, July 17, 2018 
Galencia, PC, July 17, 2018 
Celestial Hacker Girl Jessica, PC, July 17, 2018 
Lu Bu Maker, PC, July 17, 2018 
Summer: Jigsaw Puzzles, PC, July 17, 2018 
Horse Farm, PC, July 17, 2018 
VRGROUND : Crazy Farm, PC, July 17, 2018 
Intelligence: Dinosaurs, PC, July 17, 2018 
DayD: Through time, PC, July 17, 2018 
Cursed Queen : Wicked Witch, PC, July 17, 2018 
Roman The Worm, PC, July 17, 2018 
Envoy of Nezphere, PC, July 17, 2018 
Blood Bowl: Death Zone, PC, July 17, 2018 
Hitman - Summer Pack, PC, July 17, 2018 
Archangel: Hellfire, PC, July 17, 2018 
Hex 2, PC, July 17, 2018 
Gustavo Kingdom Rebirth, PC, July 17, 2018 
Sonic Mania Plus, PC, July 17, 2018 
Sonic Mania: Encore Pack, PC, July 17, 2018 
DillyMineSweeper, PC, July 17, 2018 
Fruit War, PC, July 17, 2018 
GNOG, PC, July 16, 2018 
Crystal Vibes feat. Ott., PC, July 16, 2018 
Wizard Hunter 2348, PC, July 16, 2018 
Super Skull Smash GO! 2 Turbo, PC, July 16, 2018 
Thief of Thieves: Season One, PC, July 16, 2018 
Don't Bite Me Bro!, PC, July 16, 2018 
Snail Racer EXTREME, PC, July 16, 2018 
Women's Soccer Manager, PC, July 16, 2018 
Queen of Spades, PC, July 16, 2018 
The Life's Lane, PC, July 16, 2018 
Tribloos 3, PC, July 16, 2018 
Another Otter, PC, July 16, 2018 
10 seconds, PC, July 16, 2018 
HyperZen Training, PC, July 16, 2018 
Ecchi Puzzle, PC, July 16, 2018 
Pif Paf, PC, July 16, 2018 
Kitrinos: Inside the Cube, PC, July 16, 2018 
Her, PC, July 16, 2018 
Vampirina's Nails, PC, July 16, 2018 
Vacation Adventures: Cruise Director 5, PC, July 16, 2018 
Dude Cops, PC, July 16, 2018 
Barbarroja, PC, July 15, 2018 
Fitzzle Regal Tigers, PC, July 15, 2018 
Rabbit and the moon, PC, July 15, 2018 
Beasts&Chests, PC, July 15, 2018 
Ghostbusters VR: Showdown, PC, July 15, 2018 
unBorn, PC, July 14, 2018 
The Amazing Adventures of Lady Fanny Featherstone, PC, July 14, 2018 
Vogue, The Explorer, PC, July 14, 2018 
Outside the Lines, PC, July 14, 2018 
Bleeding Sun, PC, July 14, 2018 
Amaze'd, PC, July 14, 2018 
The Strangers, PC, July 14, 2018 
Fear for Sale: Tiny Terrors, PC, July 14, 2018 
BinaryBotsVR, PC, July 14, 2018 
The Vagrant, PC, July 13, 2018 
Roll'd, PC, April 14, 2016 
Tyto Ecology, PC, April 14, 2016 
XorceD: Sashiro's Laedrum, PC, April 14, 2016 
Wobbly Jungle, PC, April 14, 2016 
Metal Slug 2, PC, April 14, 2016 
Lucid9: Inciting Incident, PC, April 14, 2016 
Sector 724, PC, April 14, 2016 
Mystery of the Ancients: Mud Water Creek, PC, April 14, 2016 
Mordheim: City of the Damned - Doomweaver, PC, April 14, 2016 
Mordheim: City of the Damned - Wolf-Priest of Ulric, PC, April 14, 2016 
Mahjong Magic Journey 2, PC, April 14, 2016 
Clash of the Monsters, PC, April 13, 2016 
Club Life, PC, April 13, 2016 
Hero Quest: Tower Conflict, PC, April 13, 2016 
Welkin Road, PC, April 13, 2016 
Discovering Colors - Animals, PC, April 13, 2016 
Wand Wars, PC, April 13, 2016 
Twilight Struggle, PC, April 13, 2016 
Auro: A Monster-Bumping Adventure, PC, April 13, 2016 
Veer, PC, April 13, 2016 
Skullgirls: 2nd Encore, PC, April 13, 2016 
Fallout 4: Wasteland Workshop, PC, April 12, 2016 
Democracy 3: Africa, PC, April 12, 2016 
Stories: The Path of Destinies, PC, April 12, 2016 
Infestation World, PC, April 12, 2016 
Starship: Nova Strike, PC, April 12, 2016 
Pub Encounter, PC, April 12, 2016 
Marble Void, PC, April 12, 2016 
Krog Wars, PC, April 12, 2016 
Dear RED - Extended, PC, April 12, 2016 
Zenge, PC, April 12, 2016 
Silver Tale, PC, April 12, 2016 
IGT Slots: Wild Bear Paws, PC, April 12, 2016 
The Far Kingdoms: Magic Mosaics, PC, April 12, 2016 
Dark Souls III, PC, April 11, 2016 
Kim, PC, April 11, 2016 
Julai, PC, April 11, 2016 
Beyond The Destiny, PC, April 11, 2016 
Chunks, PC, April 11, 2016 
Zasa - An AI Story, PC, April 11, 2016 
The Lost Souls, PC, April 11, 2016 
Discovr Egypt: King Tut's Tomb, PC, April 11, 2016 
Dawn of the Robot Empire, PC, April 11, 2016 
Assassin's Creed Syndicate: The Dreadful Crimes, PC, April 11, 2016 
ClearIt, PC, April 11, 2016 
The Contact, PC, April 10, 2016 
Dead Man's Journey, PC, April 9, 2016 
Love Chronicles: Beyond the Shadows, PC, April 9, 2016 
Warden: Melody of the Undergrowth, PC, April 8, 2016 
Game Tycoon 2, PC, April 8, 2016 
Automata Empire, PC, April 8, 2016 
Fortify (Holgersson Entertainment), PC, April 8, 2016 
AuroraRL, PC, April 8, 2016 
Glitchrunners, PC, April 8, 2016 
Tenrow, PC, April 8, 2016 
Silver Bullet: Prometheus, PC, April 8, 2016 
BLEAK: Welcome to Glimmer, PC, April 8, 2016 
Virtual Rogue, PC, April 8, 2016 
Party Saboteurs: After Party, PC, April 8, 2016 
The Hero Project: Redemption Season, PC, April 8, 2016 
Ace of Seafood, PC, April 8, 2016 
VReakout, PC, April 8, 2016 
Space Scaven, PC, April 8, 2016 
Technolust, PC, April 8, 2016 
MXGP2: The Official Motocross Videogame, PC, April 7, 2016 
A Blind Legend, PC, April 7, 2016 
Slime Jumper, PC, April 7, 2016 
Flat Kingdom, PC, April 7, 2016 
Atriage, PC, April 7, 2016 
The Fifth Expedition, PC, April 7, 2016 
Axes and Acres, PC, April 7, 2016 
Mushroom Wars, PC, April 7, 2016 
NO THING, PC, April 7, 2016 
One Last Chance, PC, April 7, 2016 
Trench Run, PC, April 7, 2016 
Antenna, PC, April 7, 2016 
Endless Legend - Shifters, PC, April 7, 2016 
Tangled Up!, PC, April 7, 2016 
Phantasmat: Town of Lost Hope, PC, April 7, 2016 
Campus Notes - forget me not., PC, April 6, 2016 
Impulse!, PC, April 6, 2016 
Kill to Collect, PC, April 6, 2016 
Outrage, PC, April 6, 2016 
Amaranthine, PC, April 6, 2016 
Little Walker, PC, April 6, 2016 
Odd||Even, PC, April 6, 2016 
Dariusburst: Chronicle Saviours - Fantasy Zone, PC, April 6, 2016 
Dariusburst: Chronicle Saviours - Galaxy Force II, PC, April 6, 2016 
Dariusburst: Chronicle Saviours - Space Harrier, PC, April 6, 2016 
Fantasy Quest 2, PC, April 6, 2016 
Enter the Gungeon, PC, April 5, 2016 
Good Robot, PC, April 5, 2016 
Hover Junkers, PC, April 5, 2016 
A Legend of Luca, PC, April 5, 2016 
The Gallery - Episode 1: Call of the Starseed, PC, April 5, 2016 
Quantum Break, PC, April 5, 2016 
Felt Tip Circus, PC, April 5, 2016 
The Rose and I, PC, April 5, 2016 
Space Pirate Trainer, PC, April 5, 2016 
Marble Mountain, PC, April 5, 2016 
AVATARIKA, PC, April 11, 2017 
Desert Battle, PC, April 11, 2017 
Toukiden 2: Mission Collection Set 3, PC, April 11, 2017 
Make it Big in Hollywood, PC, April 11, 2017 
The Signal From Tolva, PC, April 10, 2017 
Happy Campers, PC, April 10, 2017 
Cluckles' Adventure, PC, April 10, 2017 
Trapper Knight, Sharpshooter Princess, PC, April 10, 2017 
Spark the Electric Jester, PC, April 10, 2017 
Japanese Women - Animated Jigsaws, PC, April 10, 2017 
Endless Horde, PC, April 10, 2017 
The Safeguard Garrison 2, PC, April 10, 2017 
Hunahpu: way of the Warrior, PC, April 10, 2017 
The Hunted, PC, April 10, 2017 
The Melody of Dust, PC, April 10, 2017 
Escape Lizards, PC, April 10, 2017 
SYNCH, PC, April 10, 2017 
1001 Jigsaw World Tour: Asia, PC, April 10, 2017 
Getaway Island, PC, April 9, 2017 
Fluffy Creatures VS The World, PC, April 9, 2017 
Bottle Flip Challenge VR, PC, April 9, 2017 
Fausts Alptraum, PC, April 8, 2017 
Hidden Expedition: Pearl of Discord, PC, April 8, 2017 
Chernobyl: Terrorist Attack, PC, April 8, 2017 
Kindergarten, PC, April 8, 2017 
White Noise 2, PC, April 7, 2017 
Bulletstorm: Full Clip Edition, PC, April 7, 2017 
Slime-san, PC, April 7, 2017 
Trickshot (2017), PC, April 7, 2017 
Missile Cards, PC, April 7, 2017 
Bullet Soul, PC, April 7, 2017 
Stardrift Nomads, PC, April 7, 2017 
BADASS, PC, April 7, 2017 
The Quest for Achievements, PC, April 7, 2017 
Forestry, PC, April 7, 2017 
Civil War: 1865, PC, April 7, 2017 
Cannons-Defenders: Steam Edition, PC, April 7, 2017 
Duck Hunting, PC, April 7, 2017 
Fields XY, PC, April 7, 2017 
Kith: Tales from the Fractured Plateaus, PC, April 7, 2017 
Evil Tag, PC, April 7, 2017 
RGBverse, PC, April 7, 2017 
GORB, PC, April 7, 2017 
Zombie Buster VR, PC, April 7, 2017 
Dungeon Escape VR, PC, April 7, 2017 
The Franz Kafka Videogame, PC, April 6, 2017 
Europa Universalis IV: Mandate of Heaven, PC, April 6, 2017 
Zup! Zero, PC, April 6, 2017 
ZiL Truck RallyCross, PC, April 6, 2017 
Personal Disco VR, PC, April 6, 2017 
Embers of Magic, PC, April 6, 2017 
BOROS, PC, April 6, 2017 
Clumsy Knight, PC, April 6, 2017 
Survival Driver, PC, April 6, 2017 
The Cable Center: Virtual Archive, PC, April 6, 2017 
Stellaris: Utopia, PC, April 6, 2017 
Golf for Workgroups, PC, April 6, 2017 
Your Friend Hana, PC, April 6, 2017 
Hearthstone: Heroes of Warcraft - Journey to Un'Goro, PC, April 6, 2017 
Enchanted Kingdom: A Dark Seed, PC, April 6, 2017 
Record of Lodoss War Online, PC, April 6, 2017 
CEREVRUM GAME, PC, April 6, 2017 
Yooka-Laylee, PC, April 5, 2017 
Shovel Knight: Specter of Torment, PC, April 5, 2017 
Paradigm, PC, April 5, 2017 
One Hit KO, PC, April 5, 2017 
SoulSaverOnline, PC, April 5, 2017 
Radiant Crusade, PC, April 5, 2017 
Farm World, PC, April 5, 2017 
Galactic Keep, PC, April 5, 2017 
Tank Assault X, PC, April 5, 2017 
TurretCraft, PC, April 5, 2017 
Saucer-Like, PC, April 5, 2017 
Fractured State, PC, April 5, 2017 
Amber Tail Adventure, PC, April 5, 2017 
Whispers: Last Hope, PC, April 5, 2017 
Cinderella Phenomenon - Otome/Visual Novel, PC, April 5, 2017 
Slug Blast, PC, April 5, 2017 
Kio's Adventure, PC, April 5, 2017 
A Lost Room, PC, April 5, 2017 
Catsby, PC, April 5, 2017 
MARS VR, PC, April 5, 2017 
Oogie, PC, April 5, 2017 
Blackwood Crossing, PC, April 4, 2017 
FlatOut 4: Total Insanity, PC, April 4, 2017 
LEGO City Undercover, PC, April 4, 2017 
Flamel's miracle, PC, April 4, 2017 
Roots of Insanity, PC, April 4, 2017 
Arcane RERaise, PC, April 4, 2017 
Invicta Beam, PC, April 4, 2017 
Dead Rising 4: Frank Rising, PC, April 4, 2017 
Serious Sam VR: The Second Encounter, PC, April 4, 2017 
Armor Clash II, PC, April 4, 2017 
Lil Tanks, PC, April 4, 2017 
VR Chair Games, PC, April 4, 2017 
Zen Garden, PC, April 4, 2017 
VR Interior Designer Pro, PC, April 4, 2017 
Sweet fantasy, PC, April 4, 2017 
Diorama Worlds, PC, April 4, 2017 
Chaos Edge, PC, April 4, 2017 
I.S.U., PC, April 20, 2018 
Platform Challenge, PC, April 20, 2018 
My Safe House, PC, April 20, 2018 
BlindMaze, PC, April 20, 2018 
9 Balls, PC, April 20, 2018 
Achievement Hunter: Knight, PC, April 20, 2018 
PUTIN, BOOBS and TRUMP, PC, April 20, 2018 
City Escaper, PC, April 20, 2018 
pixelBOT EXTREME!, PC, April 20, 2018 
Croc's World Construction Kit, PC, April 20, 2018 
BOOBS ON ISLAND, PC, April 20, 2018 
Dodge Show, PC, April 20, 2018 
Hard Way To Heaven, PC, April 20, 2018 
Hypnotic Experience - ANOIX, PC, April 20, 2018 
NeoSticks, PC, April 20, 2018 
Dead Tropics, PC, April 20, 2018 
Cube Life: Island Survival, PC, April 20, 2018 
VOLTED, PC, April 20, 2018 
Courtyard Broomball, PC, April 20, 2018 
For the King, PC, April 19, 2018 
Bedlamball, PC, April 19, 2018 
Watch Me Jump, PC, April 19, 2018 
Super Tony Land, PC, April 19, 2018 
Atomic Heist, PC, April 19, 2018 
Tori, PC, April 19, 2018 
Steampunk Tower 2, PC, April 19, 2018 
Trash Story, PC, April 19, 2018 
The Capture Worlds, PC, April 19, 2018 
Doodle Date, PC, April 19, 2018 
Micro Pico Racers, PC, April 19, 2018 
Bustories, PC, April 19, 2018 
Royal Adventure, PC, April 19, 2018 
Puppet Fever, PC, April 19, 2018 
Death Game+, PC, April 19, 2018 
Project Myriad, PC, April 19, 2018 
Fitness Simulator, PC, April 19, 2018 
The Platformer Gun, PC, April 19, 2018 
Eon Fleet, PC, April 19, 2018 
Blind Mind, PC, April 19, 2018 
Food From The Sky, PC, April 19, 2018 
OS:Path, PC, April 19, 2018 
Show Me What You Got, PC, April 19, 2018 
Void Cube Runner, PC, April 19, 2018 
Intelligence, PC, April 19, 2018 
Walls in Dead, PC, April 19, 2018 
Trivia Vault: Tennis Trivia, PC, April 19, 2018 
Zombie Serial Killer Incident, PC, April 19, 2018 
Edge of Reality: Fatal Luck, PC, April 19, 2018 
Psychonauts in the Rhombus of Ruin, PC, April 19, 2018 
Alice In VR, PC, April 19, 2018 
Quadrium, PC, April 19, 2018 
Exploration Pro, PC, April 19, 2018 
Talisman: Digital Edition - Character Pack #17 Woodsman, PC, April 19, 2018 
Block'hood VR, PC, April 19, 2018 
Escape Treasure Island, PC, April 19, 2018 
Ping Pong Hero, PC, April 19, 2018 
The Spatials: Galactology, PC, April 18, 2018 
Healer's Quest, PC, April 18, 2018 
Supposedly Wonderful Future, PC, April 18, 2018 
Space God, PC, April 18, 2018 
Legend Knight, PC, April 18, 2018 
Samba Shooter, PC, April 18, 2018 
War Brokers, PC, April 18, 2018 
Porcuball, PC, April 18, 2018 
The New Girl, PC, April 18, 2018 
Abnormal world: season one, PC, April 18, 2018 
Geeste, PC, April 18, 2018 
Ninja Striker!, PC, April 18, 2018 
VR Benchmark Kanojo, PC, April 18, 2018 
FlappyU, PC, April 18, 2018 
Hit The Hive, PC, April 18, 2018 
Ladybird Reflect, PC, April 18, 2018 
BARRAGE, PC, April 18, 2018 
Planum, PC, April 18, 2018 
HATCHICK, PC, April 18, 2018 
ASCII Achievement Mania: Space Shooter, PC, April 18, 2018 
Battle Ground Training, PC, April 18, 2018 
Kama Bullet Heritage 2, PC, April 18, 2018 
Knight Bewitched, PC, April 18, 2018 
Russian AYE Horror, PC, April 18, 2018 
City Bus Simulator 2018, PC, April 18, 2018 
SOK IZI, PC, April 18, 2018 
Zima uhodi!, PC, April 18, 2018 
Laws of Machine, PC, April 18, 2018 
Tactical Chronicle, PC, April 18, 2018 
SOK MIN, PC, April 18, 2018 
Dead Ground: Arena, PC, April 18, 2018 
Tempest Citadel, PC, April 17, 2018 
Guard of Wonderland VR, PC, April 17, 2018 
Star Swapper, PC, April 17, 2018 
Crazy Science: Long Run, PC, April 17, 2018 
Strategic Command Classic: WWII, PC, April 17, 2018 
Pinball FX3 - Star Wars: The Last Jedi, PC, April 17, 2018 
Baptize Billy, PC, April 17, 2018 
Dr. Pills, PC, April 17, 2018 
Havoc in heaven, PC, April 17, 2018 
Roller Coaster Apocalypse VR, PC, April 17, 2018 
Dark Ghost RPG, PC, April 17, 2018 
Techwars Deathmatch, PC, April 17, 2018 
Game of the forgotten Gods. Wake up, PC, April 17, 2018 
Bible Test, PC, November 27, 2018 
Loria, PC, November 27, 2018 
The blue-diamond Damsel in distress, PC, November 27, 2018 
Classic Card Games 3D, PC, November 27, 2018 
RGB RUN, PC, November 27, 2018 
School of the Dead: Anastasia, PC, November 27, 2018 
Experience: Colorblindness, PC, November 27, 2018 
3 Days in the Abyss, PC, November 27, 2018 
Zuma Legend VR, PC, November 27, 2018 
Kings' Cross, PC, November 27, 2018 
Pixel Puzzles 2: Christmas, PC, November 27, 2018 
Project Eagle: A 3D Interactive Mars Base, PC, November 27, 2018 
